apygarda,gimimo_data,seimynine_padetis,sunkus_nusikaltimas,darboviete,kandidatas,gyvena,issilavinimas,pomegiai,gimimo_vieta,iskele,tautybe,saraso_numeris,uzsienio_kalbos,pripazintas_kaltu,neatlikta_bausme
Prienų - Birštono,1970-01-03,ištekėjusi,Ne,",",RIMA    ZABLACKIENĖ,Pakuonio mstl.,Aukštasis universitetinis;M. Romerio universitetas;Savivaldos institucijų administravimas;2010;Aukštasis universitetinis;Vilniaus pedagoginis universitetas;Matematika - informatika;1993,"KInologija, gėlininkystė, teatras, menas, kelionės",Prienai,Darbo partija,lietuvė ,,"rusų, anglų",Ne,Neturiu
Pasvalio - Panevėžio,1969-01-29,išsiskyręs,Ne,"ŽŪK ""Eriškių pienas"",Direktorius gyvulių supirkimai - pardavimai",VYTAUTAS    LIEPA,Tarnagalos k.,Panevėžio raj. savivaldybės taryba; - ;Panevėžio raj. savivaldybės taryba; - ,"Informacinės technologijos, automobiliai",Pasvalys,Darbo partija,lietuvis ,,"rusų, vokiečių",Ne,Neturiu
Tauragės,1969-03-31,išsituokęs,Ne,"UAB ""Globegas"",Direktorius",VAIDOTAS    GLOBYS,Antšunijų k.,Aukštasis;Kauno technologijos universitetas;Verslo administravimas;2007,"Sportas, laisvalaikis gamtoje, kūrybinė veikla",Tauragė,Darbo partija,lietuvis ,,"lenkų, anglų, rusų",Ne,Neturiu
Kelmės,1964-10-10,vedęs,Ne,"LR Seimo kancialerija,LR Seimo nario K. Daukšio padėjėjas - sekretorius",BORISAS    MARKULIS,Dikšių k.,Aukštasis;ŠŪ;Verslo ir vadybos administravimas;2009;Aukštesnysis;Plungės statybos technikumas;St. technikas;1987,Kelionės,"Palonių k., Kelmės raj.",Darbo partija,rusas ,,rusų,Ne,Neturiu
Zarasų - Visagino,1972-06-26,vedęs,Ne,"UAB ""Samaniai"",Direktorius",RIMVYDAS    PODOLSKIS,Zarasai,Studijuoju;Lietuvos edukologijos universitetas;-;2012;Aukštesnysis;Zarasų žemės ūkio mokykla;-;1990,"Žvejyba, kelionės",Zarasai,Darbo partija,lietuvis ,,"rusų, vokiečių, lenkų",Ne,Neturiu
Kaišiadorių - Elektrėnų,1983-04-14,nevedęs,Ne,"Individuali veikla (teisinės konsultacijos),",STANISLOVAS    TOMAS,Vilnius,Aukštasis;Paryžiaus I Sorbonos universitetas;Teisė;2010;Aukštasis;Šventojo Liudviko universitetas;Teisė;2005;Aukštasis;Briuselio Katališkasis universitetas;Teisė;2005;Aukštasis;Europos teisės teorijos akademija;Teisė;2005;Aukštasis;Vilniaus universitetas;Teisė;2004,"Šachmatai, baseinas","Pavlodaras, Kazachstanas",Darbo partija,lietuvis ,,"prancūzų, anglų, rusų, lenkų, ispanų, vokiečių, latvių, olandų",Ne,Neturiu
Dainavos,1950-10-18,Nenurodė,Ne,"VŠĮ Respublikos Kauno ligoninė,Skyriaus vedėjas",GEDIMINAS    GRIGAS,Kaunas,Aukštasis;Kauno Medicinos institutas;Kraujagyslių chirurgas;1975,"Tenisas, žvejyba",Kaunas,Darbo partija,lietuvis ,,"rusų, lenkų, anglų",Ne,Neturiu
Antakalnio,1976-08-08,vedęs,Ne,",",GINTARAS    TAMOŠIŪNAS,Vilnius,Magistras;MRU;Viešasis administravimas;2003;Aukštasis;MRU;Teisininkas;2001,"Sportas, muzika, kelionės",Šiauliai,Darbo partija,lietuvis ,,"anglų, rusų",Ne,Neturiu
Daugiamandatė,1955-07-28,Nenurodė,Ne,",",SAULIUS    GIEDRAITIS,Kaunas,,,,Darbo partija, ,,,Ne,Neturiu
Daugiamandatė,1983-04-07,nevedęs,Ne,"Single resource,Darbininkas",DARIUS    JANKŪNAS,Vievis,Aukštasis;Vilniaus technologijų ir dizaino kolegija;Medijų meno bakalauras;2006,"Sportas, menai, muzika",Trakai,Darbo partija,lietuvis ,,"rusų, lenkų, vokiečių",Ne,Neturiu
Daugiamandatė,1959-07-11,išsiskyręs,Ne,"UAB ""Telšių regiono atliekų tvarkymo centras"",Direktorius",RIMANTAS    ADOMAITIS,Telšiai,"Aukštasis;Šiaulių K. Preikšo pedagoginis institutas;Matematikos, fizikos mokytojas;1982","Medžioklė, turizmas motociklu","Varniai, Telšių raj.",Darbo partija,lietuvis ,,"rusų, vokiečių",Ne,Neturiu
Dzūkijos,1966-08-28,vedęs,Ne,"Alytaus raj. savivaldybės BĮ Priešgaisrinės apsaugos tarnyba,Direktorius",RAIMUNDAS    MARKAUSKAS,Alytus,Aukštasis;Kauno technologijos univesitetas;Inžinierius;1991,Laisvalaikiu domiuosi savo krašto istorija,Alytus,Darbo partija,lietuvis ,,"rusų, anglų",Ne,Neturiu
Aukštaitijos,1953-03-18,vedęs,Ne,"Lietuvos Respublikos valstybinė darbo inspekcija prie socialinės apsaugos ir darbo ministerijos,Panevėžio teritorinio skyriaus vdėjas",RIMANTAS    TROTA,Molainių k.,Magistras;Kauno technologijos universitetas;Vadybos ir verslo administratorius;2004;Aukštasis;Jelgavos ž.ū. akademija;Elektros pavaos;1993;Aukštasis;Kauno politechnikos institutas;Inžinierius - konstruktorius;1976,"Fotografavimas, filmavimas, muzikavimas, turizmas","Bastūnų k., Želvos sen., Ukmergės raj.",Darbo partija,lietuvis ,,"rusų, vokiečių",Ne,Neturiu
Pajūrio,1952-02-13,ištekėjusi,Ne,"Klaipėdos valstybinė kolegija,Lektorė",GENOVEITA    KRASAUSKIENĖ,Palanga,Aukštasis;Kauno technologijos universitetas;Viešasis administravimas;2004;Aukštasis;Vilniaus universitetas;Filologė ir anglų kalbos dėstytoja;1976,"Laisvalaikiu mėgstu skaityti knygas, domiuosi psichologija, mėgstu aktyvų poilsį gamtoje","Kaukolikų k., Skuodo raj.",Darbo partija,lietuvė ,,"anglų, rusų, vokiečių",Ne,Neturiu
Danės,1941-01-01,išsiskyręs,Ne,",",BENAS    ŠIMKUS,Klaipėda,"Klaipėdos m. savivaldybė, mero pavaduotojas; - ","Bitininkystė, sodininkystė, medžioklė, sportas","Lieplaukės k., Telšių raj.",Darbo partija,lietuvis ,,"rusų, latvių, vokiečių, anglų",Ne,Neturiu
Daugiamandatė,1964-08-01,ištekėjusi,Ne,"KTU,Docentė",JOLANTA    SOLNYŠKINIENĖ,Radikių k.,Aukštasis;KTU ir VDU;-;2000;Aukštasis;KTU;Inžinierius - ekonomistas;1988,"Mokslinės ir publicistinės literatūros ekonominė ir geopolitikos tematika studijos, mena, psichologija, sportas, aktyvios pramogos (baidarės ir raftingas)",Pakruojis,Darbo partija,lietuvė ,,"rusų, anglų",Ne,Neturiu
Daugiamandatė,1936-04-17,vedęs,Ne,",",PRANAS    VILKAS,Vilnius,Aukštasis;Kauno politechnikos universitetas;Inžinierius - mechanikas;1959,,"Gaižiūnų k., Jonavos raj.",Darbo partija,lietuvis ,,"rusų, lenkų, prancūzų",Ne,Neturiu
Daugiamandatė,1978-07-01,išsituokusi,Ne,"Lietuvos Respublikos Seimas,Seimo nario padėjėja -  sekretorė",GIEDRĖ    VITIENĖ,Vilnius,Aukštasis;Vilniaus universitetas;Paslaugų vadyba;2008,"Kalnų sportas, kelionės, knygos",Kėdainiai,Darbo partija,lietuvė ,,"anglų, rusų",	 ,Neturiu
Daugiamandatė,1965-06-03,vedęs,Ne,"Kalvarijos savivaldybės taryba,Mero pavaduotojas",ANTANAS    BURINSKAS,Kalvarija,Aukštasis;KTU;Vadybos ir verslo administravimas;2012;Aukštasis;marijampolės kolegija;Verslo vadyba;2010;Aukštesnysis;Vilniaus 21 tech. mokykla;Radistas;1984,"Kelionės, turizmas","Vidgirių k., Vilkaviškio raj.",Darbo partija,lietuvis ,,"rusų, vokiečių",Ne,Neturiu
Daugiamandatė,1985-08-19,nevedęs,Ne,"UAB ""Gintaro sodyba"",Savininkas",GINTARAS    STEPONĖNAS,Kaltanėnų k.,Aukštasis;Vilniaus verslo kolegija;Verslo vadyba - finansai;2013,Dirbti visuomeninį darbą žmonių gerovei,"Švenčionėliai, Švenčionių rajonas",Darbo partija,lietuvis ,,"rusų, anglų",Ne,Neturiu
Šeškinės,1948-11-21,vedęs,Ne,",",VYTAUTAS    GRICIUS,Vilnius,Aukštasis;Lietuvos žemės ūkio akademija;Ekonomistas;1972,"Mėgstu keliauti, būti gamtoje. Žaviuosi Lietuvos dailininkų kūriniais, klasikine, šiuolaikine muzika ir džezu","Salantai, Kretingos raj.",Darbo partija,lietuvis ,,"rusų, anglų, prancūzų",Ne,Neturiu
Mažeikių,1960-09-21,išsiskyręs,Ne,"UAB ""Roventa"",Generalinis direktorius",ROMAS    VENCLOVAS,Mažeikiai,Aukštasis;Vilniaus inžinerinis statybos institutas;Pramoninės ir civilinės statybos inžinierius;1992;Aukštesnysis;Plungės statybos technikumas;Pramoninės ir civilinės statybos inžinierius;1980,"Politika, literatūra, gamta, automobiliai, kelionės, televizija","Kretingalė, Klaipėdos rajonas",Darbo partija,lietuvis ,,"anglų, rusų",Ne,Neturiu
Daugiamandatė,1957-08-04,vedęs,Ne,"UAB Vakarų Lietuvos pramonės ir finansų korporacija,Sporto kompleksų direktorius",IVANAS    ROMANOVAS,Klaipėda,Aukštasis;Šiaulių K. Preikšo pedagoginis institutas;Vaikų pedagogika ir psichologija;1987,"Sportas, kelionės, muzika, knygos","Kretingalė, Klaipėdos rajonas",Darbo partija,lietuvis ,,"rusų, vokiečių",Ne,Neturiu
Kretingos,1978-10-02,vedęs,Ne,"Vilniaus m. III advokatų kontora,Advokatas",GIEDRIUS    MOZŪRAITIS,Vilnius,Aukštasis;Lietuvos teisės universitetas (dabar - Mykolo Romerio universitetas);Teisininkas;2001;Aukštasis;Lietuvos teisės universitetas (dabar - Mykolo Romerio universitetas);Teisininkas;1999,Šachmatai,Kaunas,Darbo partija,lietuvis ,,"anglų, rusų",Ne,Neturiu
Pramonės,1956-07-25,išsituokusi,Ne,"Kauno technologijos universitetas,Įmonių - ekonomikos katedros vedėja, profesorė",ŽANETA    SIMANAVIČIENĖ,Kaunas,Daktaro laipsnis;Maskvos Lomonosovo universitetas;Ekonimika;2005;Daktaro laipsnis;Maskvos Lomonosovo universitetas;Ekonomika;1987;Aukštasis;KPI;Inžinierius - ekonomistas;1979,,Vilnius,Darbo partija,lietuvė ,,"anglų, lenkų, rusų",Ne,Neturiu
Naujosios Vilnios,1952-01-07,vedęs,Ne,"Vilniaus raj. ŽŪB ""Kyviškės"",Likvidacinės komisijos pirmininkas",SERGEJ    URSUL,Vilnius,Aukštasis;Lietuvos žemės ūkio akademija;Mokslinis agronomas;1977,"Muzika, kelionės","Lipecko k., Kotovskio raj., Odesos srt., Ukraina",Darbo partija, ,,"lenkų, rusų, moldavų, ukrainiečių, vokiečių pagrindai",Ne,Neturiu
Suvalkijos,1965-03-25,ištekėjusi,Ne,"Marijampolės kolegija, Kauno PPA rūmų, Marijampolės filialas,MK lektorė, filialo direktorė",ALGIMANTA    PABEDINSKIENĖ,Patašinės k.,Aukštasis;KTU;Įmonių valdymas;2005;Aukštasis;KTU;Įmonių valdymas;2004;Aukštasis;VGTU;Pramonė ir civilinės statyba;1988,"Fotografija, politika, šachmatai, kelionės","Liepoja, Latvija",Darbo partija,lietuvė ,,"anglų, rusų, lenkų, latvių",Ne,Neturiu
Daugiamandatė,1962-07-03,ištekėjusi,Ne,"Švenčionių raj. savivaldybė,Mero pavaduotoja",RAJA    KRUPENINA,Adutiškio mstl.,Aukštasis;Vilniaus universitetas;Matematika;1984,,"Kalelių k., Ignalinos raj.",Darbo partija,lietuvė ,,rusų,Ne,Neturiu
Kauno kaimiškoji,1968-12-12,vedęs,Ne,"Kauno raj. savivaldybės administracija,Mero pavaduotojas",ANTANAS    MAKAREVIČIUS,Noreikiškių k.,Aukštasis;LVA;Zooinžinierius;1993,"Kelionės, turizmas",Kaunas,Darbo partija,lietuvis ,,"lenkų, rusų",Ne,Neturiu
Daugiamandatė,1986-11-18,nevedęs,Ne,"UAB ""Lintel"",Grupės vadovas",MARIUS    VASILEVIČIUS,Klaipėda,Aukštasis neuniversitetinis;Klaipėdos valstybinė kolegija;Kultūrinės veiklos vadyba;2008,"Teatras, muzika, kelionės, renginių organizavimas",Telšiai,Darbo partija,lietuvis ,,"anglų, rusų, vokiečių",Ne,Neturiu
Skuodo  - Mažeikių,1958-07-21,ištekėjusi,Ne,"Skuodo raj. savivaldybės administracija,Švietimo skyriaus vyriausioji specialistė",AUDRONĖ    PITRĖNIENĖ,Skuodas,Magistras;Klaipėdos universitetas;Edukologija;2004;Aukštasis;Vilniaus valstybinis pedagoginis institutas;Biologijos ir žemės ūkio pagrindų mokytoja;1984,"Renginių scenarijų rašymas, renginių vedimas","Lenkimų k., Skuodo raj.",Darbo partija,lietuvė ,,"rusų, vokiečių",Ne,Neturiu
Šilutės - Pagėgių,1963-01-28,vedęs,Ne,"UAB ""Sauliaus transporto sistemos"",Valdybos pirmininkas",SAULIUS    STANKEVIČIUS,Šilutė,Aukštasis;Klaipėdos universitetas;Vadybos meistas;2006;Aukštasis;Kauno technologijos universitetas;Radio inžinierius;2004,"Atvirukų kolekcionavimas, fotografija, tenisas, motociklai, nardymas, žvejyba","Vilkija, Kauno raj.",Darbo partija,lietuvis ,,"rusų, anglų, vokiečių",Ne,Neturiu
Daugiamandatė,1963-02-28,ištekėjusi,Ne,"Alytaus m. savivaldybė,Mero pavaduotoja",DANGUOLĖ    JUOZAPAVIČIENĖ,Alytus,Magistras;Kauno technologijos universitetas;Viešasis administravimas;2007;Aukštasis;Lietuvos veterinarijos akademija;Zooinžinierius pedagogas;1988,"Teatras, kelionės, knygų skaitymas",Šilutės raj.,Darbo partija,lietuvė ,,"rusų, anglų",Ne,Neturiu
Saulės,1965-10-10,išsituokusi,Ne,"Šiaulių m. savivaldybė,mero pavaduotoja",DANGUOLĖ    MARTINKIENĖ,Šiauliai,Aukštasis;Lietuvos veterinarijos akademija;Zooinžinerija;1988,"Liaudies medicina, joga, sportas, teatras, poezija","Ringuvėnų k., Šiaulių raj.",Darbo partija,lietuvė ,,"rusų, anglų",Ne,Neturiu
Molėtų - Švenčionių,1967-09-22,Nenurodė,Ne,",",PETRAS    ČIMBARAS,Levaniškių k.,,,,Darbo partija, ,,,Ne,Neturiu
Daugiamandatė,1961-07-05,išsiskyręs,Ne,"Lietuvos automobilių sporto federacija,Prezidentas",GINTARAS JONAS    FURMANAVIČIUS,Kaunas,Aukštasis;Vytauto Didžiojo universitetas;Vadybininkas;1997;Aukštasis;Kauno politechnikos institutas;Inžinierius;1984,,Kaunas,Darbo partija,lietuvis ,,"vokiečių, rusų, anglų, lenkų",Ne,Neturiu
Daugiamandatė,1970-04-10,Nenurodė,Ne,"LR Sveikatos apsaugos ministerija,Teisės departamento viešųjų pirkimų skyriaus vedėja",SVETLANA    KAUZONIENĖ,Vilnius,Aukštasis;KTU;Vadyba ir verslo administravimas;2003;Aukštasis;KTU;technologijos mokslų daktaras;2000,,"Narva, Estija",Darbo partija,rusė ,,"rusų, lietuvių, anglų",Ne,Neturiu
Senamiesčio,1958-08-30,našlė,Ne,"Bedra Lietuvos ir JAV įmonė UAB ""Litimpex"",Direktorė",NIJOLĖ    JAGELAVIČIENĖ,Vilnius,"Aukštasis universitetinis;Vlastybinė koncervatorija;Darbo organizavimas ir metodika, klubininkystė;1988;Aukštesnysis;Vilniaus kultūros mokykla;Choreografija, klubinių įstaigų vadovas;1979",,Ukmergės raj.,Darbo partija,lietuvė ,,"rusų, vokiečių",Ne,Neturiu
Šiaulių kaimiškoji,1963-07-15,ištekėjusi,Ne,"VŠĮ ""Sportas visiems - Šiaulių regionas 2012"",",INGRIDA    VENCIUVIENĖ,Žaliūkių k.,"Magistras;Šiaulių universitetas;Viešasis administravimas;2011;Aukštasis;Šiaulių krašto, vadybos, teisės ir kalbų kolegija;Paslaugų organizavimas;2006;Aukštesnysis;Vilniaus kooperacijos technikumas;Prekių žinovė;1983","Skaitymas, kelionės","Kuršėnai, Šiaulių raj.",Darbo partija,lietuvė ,,"vokiečių, rusų",Ne,Neturiu
Daugiamandatė,1982-05-04,ištekėjusi,Ne,"UAB ""Interneto žinios"",Žurnalistė",LIJANA    JAGINTAVIČIENĖ,Šilutė,Aukštasis;Klaipėdos universitetas;Viešasis administravimas;2013;Aukštasis neuniversitetinis;Žemaitijos kolegija;Buhalterinė apskaita(specializacija apskaita biudžetinėse įmonėse);2005;Aukštesnysis;Smalininkų aukštesnioji žemės ūkio mokykla;Buhalterinė apskaita;2003,"Fotografija, knygos, kelionės","Pašiliškės k., Gardamo sen., Šilutės raj.",Darbo partija,lietuvė ,,"anglų, rusų",Ne,Neturiu
Nevėžio,1955-12-24,vedęs,Ne,"Panevėžio m. savivaldybė,Mero pavaduotojas",PETRAS    NARKEVIČIUS,Panevėžys,Aukštasis;Kauno Antano Sniečkaus politechnikos institutas;Inžinierius - statybininkas;1988,"Medžioklė, žvejyba, slidinėjimas, plaukimas",Biržai,Darbo partija,lietuvis ,,"rusų, prancūzų",Ne,Neturiu
Šakių,1960-10-25,vedęs,Ne,"VŠĮ ""Valstybės iniciatyvos"",Direktorius",GINTAUTAS    KNIUKŠTA,Pašilaičiai,Aukštasis;Lietuvos teisės universitetas;Teisė ir valdymas;2003;Aukštasis;Vilniaus valstybinis pedagoginis institutas;Biologija ir žemės ūkis;1985;Spec. vidurinis;Rietavo žemės ūkio technikumas;Agronomija;1979,"sodininkystė, kelionės","Rudaičių k., Klaipėdos raj.",Darbo partija,lietuvis ,,"anglų, rusų",Ne,Neturiu
Gargždų,1978-04-22,ištekėjusi,Ne,"Socialinių mokslų kolegija,Lektorė",ANDŽELA    ŠAKINIENĖ,Jonušų k.,Aukštasis;Mykolo Romerio universitetas;Teisė;2009,"Sportas, menas, žirgai","Švenčionėliai, Švenčionių rajonas",Darbo partija,lietuvė ,,"lenkų, rusų, vokiečių, anglų",	 ,Neturiu
Daugiamandatė,1950-02-27,ištekėjusi,Ne,"Vilniaus m. mokykla ""Saulutė"",Vyr. mokytoja",LARISA    DMITRIJEVA,Vilnius,Aukštasis;Vilniaus valstybinis universitetas;Teisininkė;1981;Aukštasis;Smolensko pedagoginis institutas;Pedagogė;1972,"Muzika, skaitymas, sportas","Smolenskas, Rusija",Darbo partija,rusė ,,"anglų, lenkų",Ne,Neturiu
Varėnos - Eišiškių,1958-05-03,vedęs,Ne,"UAB ""Respublikos leidiniai"",Apžvalgininkas",GEDIMINAS    JAKAVONIS,Glūko k.,Aukštasis;Vilniaus universitetas;Ekonomistas;1981,"Sportas, tautodailė",Varėna,Darbo partija,lietuvis ,,"rusų, lenkų, prancūzų",Ne,Neturiu
Raseinių,1971-04-21,vedęs,Ne,"AB ""Grąžtai"",Generalinis direktorius",DARIUS    ULICKAS,Raseiniai,Aukštasis;LŽŪA;Ekonomika;1994,"Muzika, kino filmai",Prienai,Darbo partija,lietuvis ,,"rusų, anglų",Ne,Neturiu
Daugiamandatė,1971-10-08,vedęs,Ne,"Alytaus raj. savivaldybė,Administracijos direktorius",AURIMAS    TRUNCĖ,Janapolio k.,Aukštasis;Lietuvos veterinarijos akademija;Veterinarijos gydytojas;1994,"Medžioklė, žvejyba, sportas","Ilgų k., Alovės sen., Alytaus raj.",Darbo partija,lietuvis ,,"lenkų, rusų",Ne,Neturiu
Pakruojo - Joniškio,1968-10-31,vedęs,Ne,"Lietuvos sveikatos mokslų universitetas,Profesorius, laboratorijos vadovas",VIGILIJUS    JUKNA,Kaunas,Aukštasis;Lietuvos veterinarijos akademija;Zooinžinierius;1991,"Aktyvus poilsis gamtoje, kelionės",Kaunas,Darbo partija,lietuvis ,,"anglų, rusų",Ne,Neturiu
Daugiamandatė,1966-06-09,vedęs,Ne,"UAB ""Aidma"",Direktorius",AIDAS    GEDVILAS,Šiauliai,Aukštasis;ŠU;Mašinų gamyba;1992;Aukštesnysis;K. Didžiulio politechnikumas;Automobilių remontas ir TA;1985,"Tinklinis, lauko tenisas, autosportas",,Darbo partija,lietuvis ,,"rusų, anglų",Ne,Neturiu
Daugiamandatė,1986-02-17,nevedęs,Ne,"LR Seimas,LR Seimo Pirmininko pavaduotojos Virginijos Baltraitienės patarėjas",PAULIUS    KALINA,Keleriškių k.,Magistras;Mykolo Romerio universitetas;Vadybos ir verslo administravimas;2010;Aukštasis;VGTU;Elektronikos inžinierius;2008,"Knygos, sportas, kelionės, medžioklė",Kėdainiai,Darbo partija,lietuvis ,,"rusų, anglų",Ne,Neturiu
Daugiamandatė,1959-11-10,vedęs,Ne,"Politinė organizacija Lietuvos Rusų sąjunga,Pirmininkas",SERGEJ    DMITRIJEV,Vilnius,Aukštasis;Smolensko pedagoginis institutas;Istorijos ir anglų kalbos mokytojas;1983,"Sportas, ypač tinklinis, muzika, literatūra, tapyba",Vilnius,Darbo partija,rusas ,,"rusų, anglų",Ne,Neturiu
Baltijos,1947-09-14,vedęs,Ne,"VŠĮ Valstybės iniciatyvos,Diretoriaus pavaduotojas strateginei plėtrai",RAIMUNDAS    PALIUKAS,Klaipėda,Aukštasis;Vilniaus Universitetas;Inžinierius - geologas;1970,"Klasikinė muzika, kalnų turizma,s kelionės",Vilnius,Darbo partija,lietuvis ,,"vokiečių, rusų",Ne,Neturiu
Rokiškio,1959-02-06,vedęs,Ne,"Rokiškio rajono savivaldybės administracija,Administracijos direktorius",ALOYZAS    JOČYS,Rokiškis,Aukštasis;Vilniaus Gedimino technikos universitetas (Vilniaus inžinerinis statybos institutas;Automobilių transporto inžinierius ekonomistas;1990,"Automobiliai, medžioklė, kelionės","Juozapavos k., Kriaunų sen., Rokiškio raj.",Darbo partija,lietuvis ,,"vokiečių, rusų",Ne,Neturiu
Jonavos,1973-07-05,vedęs,Ne,"UAB ""Jarugė"",Direktorius",SAULIUS    JAKIMAVIČIUS,Šešuvos k.,Magistras;M. Romerio universitetas;Teisė;2006;Aukštasis;Maskvos naujasis juridinis institutas;Juristas;2005;Aukštasis;Lietuvos Teisės universitetas;Teisininkas;2001;Aukštesnysis;Kauno aukštesnioji policijos mokykla;Teisininkas;1995,"Ginklai medžioklė, sportas",Kaunas,Darbo partija,lietuvis ,,"anglų, rusų, lenkų",Ne,Neturiu
Biržų - Kupiškio,1959-12-13,vedęs,Ne,"Vilniaus m. savivaldybė,Administracijos direktoriaus pavaduotojas",RITAS    VAIGINAS,Vilnius,Aukštasis;Vilniaus universitetas;Ekonomistas;1982,"Sportas, muzika, politika",Biržai,Darbo partija,lietuvis ,,"anglų, rusų",Ne,Neturiu
Anykščių - Kupiškio,1954-09-01,vedęs,Ne,"UAB Jaros sauga,komercijos direktorius",RIČARDAS    SARGŪNAS,Anykščiai,Aukštasis;Vilniaus inžinerinis statybos institutas;Inžinierius - ekonomistas;1977,"Darbas sodyboje, statybos darbai",Ukmergė,Darbo partija,lietuvis ,,"anglų, rusų",Ne,Neturiu
Naujamiesčio,1969-02-17,ištekėjusi,Ne,"UAB ""Baltic Industrials"",Komercijos direktorė",JOLANTA    GAUDUTIENĖ,Vilnius,Aukštasis;Klaipėdos universitetas;Ikimokyklinė pedagogika ir psichologija;1993;Aukštasis;Panevėžio J. Švedo pedagoginė muzikos mokykla;Dainavimo mokytojo ir muzikos vadovo;1988,"Kelionės, muzika",Mažeikių rajonas,Darbo partija,lietuvė ,,"rusų, anglų",Ne,Neturiu
Daugiamandatė,1943-08-15,vedęs,Ne,"Lietuvos Respublikos Seimas,Seimo narys",JONAS    KONDROTAS,Labūnavos k.,Aukštasis;Lietuvos žemės ūkio akademija (dabar A. Stulginskio universitetas);Mokslinis agronomas;1971,"Gamta, bendravimas su žmonėmis","Užugulbinės k., Biržų raj.",Darbo partija,lietuvis ,,rusų,Ne,Neturiu
Žirmūnų,1946-09-03,vedęs,Ne,",",GEDIMINAS    DALINKEVIČIUS,Vilnius,Aukštasis;LR Meno akademija;Smuikininkas;1969,"Plaukimas, slidinėjimas, šachmatai",Kaunas,Darbo partija,lietuvis ,,"anglų, italų, rusų, latvių, lenkų",Ne,Neturiu
Karoliniškių,1983-08-16,vedęs,Ne,"Lietuvos Respublikos Seimas,Seimo nario padėjėjas - sekretorius",VALDAS    SKARBALIUS,Jonava,Aukštasis;Kauno verslo kolegija;Tarptautinė verslo vadyba,,Kaunas,Darbo partija,lietuvis ,,"anglų, rusų",Ne,Neturiu
Vilniaus - Šalčininkų,1959-07-15,ištekėjusi,Ne,"UAB ""Ruvėja"",Direktorė",VILIJA    FILIPOVIČIENĖ,Didžiosios Riešės k.,Aukštasis universitetinis;Vilniaus universitetas;Aukštos kvalifikacijos prekių mokslų žinovė;1982,"Kelionės, ypač po Lietuva, ekonominė ir politinė literatūra","Irkucko m., Rusija",Darbo partija,lietuvė ,,"rusų, lenkų",Ne,Neturiu
Radviliškio,1955-09-30,ištekėjusi,Ne,"Šiaulių apskrities valstybinė mokesčiųinspekcija,Kontrolės departamento direktoriaus pavaduotoja",ZITA    ŽVIKIENĖ,Radviliškis,Aukštasis;Vilniaus universitetas;Teisininko;2001,"Gamta, liaudies medicina","Selvestrų k., Šilalės raj.",Darbo partija,lietuvė ,,"rusų, prancūzų",Ne,Neturiu
Ignalinos - Švenčionių,1961-09-20,vedęs,Ne,"Lietuvos praminininkų konfederacija,Atstovas Lietuvos Respublikos Seime ir Vyriausybėje",ŠARŪNAS    BIRUTIS,Vilnius,Aukštasis;MRU;Teisė ir valdymas;2003;Aukštasis universitetinis;VU;Ekonomika;1984,"Ekonomika, politinka, etnografija, sportas",Šiauliai,Darbo partija,lietuvis ,,"anglų, rusų, lenkų",Ne,Neturiu
Širvintų - Vilniaus,1975-06-21,ištekėjusi,Ne,"UAB ""Danielita"",KOmercijos direktorė",ŽIVILĖ    PINSKUVIENĖ,Širvintos,Magistras;VGTU;Aplinkos inžinierius;2003;Aukštasis;VGTU;Aplinkotvarkos inžinierius;2001,"kelionės, kalnų slidinėjimas, automobilių sportas, aktorystė",Širvintos,Darbo partija,lietuvė ,,"rusų, lenkų, anglų",Ne,Neturiu
Daugiamandatė,1980-01-29,ištekėjusi,Ne,"UAB ""Horo.lt"",Direktorė",VITALIJA    VONŽUTAITĖ,Kaunas,Bakalauras;KTU;Vadyba;2004,,Lietuva,Darbo partija,lietuvė ,,"anglų, rusų",Ne,Neturiu
Centro,1946-03-29,vedęs,Ne,"Lietuvos Respublikos Seimas,Seimo narys",MEČISLOVAS    ZASČIURINSKAS,Kaunas,Aukščiausio lygio valstybės tarnautojų mokymai;Lietuvos viešojo administravimo institutas;OLYMP programa;2005;Aukštasis;kauno politechnikos institutas;Ekonomistas;1981;Aukštasis;kauno politechnikos institutas;Inžinierius  elektrikas;1969,,Kaunas,Darbo partija,lietuvis ,,"rusų, vokiečių, lenkų",Ne,Neturiu
Kauno - Kėdainių,1959-05-17,Nenurodė,Ne,"Lietuvos Respublikos Seimas,Europos reikalų komiteto pirmininko pavaduotojas; Švietimo, mokslo ir kultūros komiteto narys; Jaunimo ir sporto reikalų komisijos narys",VYDAS    GEDVILAS,Kaunas,Doktorantūra;Lietuvos kūno kultūros akademija;Biomedicinos mokslai;1999;Aspirantūra;Lietuvos valstybinis kūno kultūros institutas;Socialiniai mokslai;1988;Aukštasis;Lietuvos valstybinis kūno kultūros institutas;Fizinio auklėjimo dėstytojas;1981,"Golfas, knygos, kelionės","Užgirių k., Kelmės raj.",Darbo partija,lietuvis ,,"rusų, vokiečių, anglų",Ne,Neturiu
Alytaus,1960-01-31,vedęs,Ne,"Lietuvos Respublikos Seimas,Seimo narys",KĘSTUTIS    DAUKŠYS,Vilnius,Aukštasis;Vilniaus valstybinis universitetas;Ekonomistas;1983,"Klasikinė muzika, lieteratūra, žvejyba, medžiai",Alytus,Darbo partija,lietuvis ,,"anglų, rusų, lenkų",Ne,Neturiu
Trakų - Elektrėnų,1966-08-06,ištekėjusi,Ne,"Lietuvos Respublikos Seimas,Seimo narė, Sveikatos reikalų komiteto narė, Narkomanijos ir alkoholizmo prevencijos komisijos pirmininko pavaduotoja",DANGUTĖ    MIKUTIENĖ,Trakai,Aukštasis;Mykolo Romerio universitetas;Viešasis administravimas;2007;Aukštasis;Lietuvos valstybinė konservatorija;Režisierė;1988,"Kelionės, politologija, filosofija, psichologija, kulinarija",Rokiškis,Darbo partija,lietuvė ,,"anglų, rusų",Ne,Neturiu
Daugiamandatė,1987-01-29,vedęs,Ne,"Europos parlamentas,Europos parlamento nario Viktoro Uspaskich asistentas",VIKTORAS    FIODOROVAS,Kėdainiai,Studijuoju;M. Romerio universitetas;Teisė ir valdymas,"Fotografavimas, filmavimas",Kėdainiai,Darbo partija,lietuvis ,,"rusų, anglų",Ne,Neturiu
Telšių,1962-11-25,vedęs,Ne,"LR Seimas,LR Seimo narys",VALENTINAS    BUKAUSKAS,Telšiai,Aukštasis neuniversitetinis;Vakarų Lietuvos Verslo kolegija;Ekonomistas;2005;Spec. vidurinis;Šiaulių K. Didžiulio politechnikumas;Technikas - elektrikas;1985,"Medžioklė, žvejyba, muziko","Sukančių k., Telšių raj.",Darbo partija,lietuvis ,,rusų,Ne,Neturiu
Fabijoniškių,1953-08-23,vedęs,Ne,"Advokato kontora ""A. Paulauskas ir partneriai"",Advokatas",ARTŪRAS    PAULAUSKAS,Vilnius,Aukštasis;Vilniaus universitetas;Teisininkas;1976,"Sportas, knygų skaitymas",Vilnius,Darbo partija,lietuvis ,,"rusų, anglų",Ne,Neturiu
Akmenės - Joniškio,1967-10-10,išsituokęs,Ne,"LR Seimas,Seimo narys",SAULIUS    BUCEVIČIUS,Naujoji Akmenė,Aukštasis;LKKA;Vadyba;2011,"Turizmas, medžioklė, sportas","Pavandenės kaimas, Kelmės raj.",Darbo partija,lietuvis ,,"lenkų, rusų",Ne,Neturiu
