apygarda,gimimo_data,seimynine_padetis,sunkus_nusikaltimas,darboviete,kandidatas,gyvena,issilavinimas,pomegiai,gimimo_vieta,iskele,tautybe,saraso_numeris,uzsienio_kalbos,pripazintas_kaltu,neatlikta_bausme
Ignalinos - Švenčionių,1952-07-03,Nenurodė,Ne ,",",ALGIRDAS    ČEPONIS,Vilnius,Aukštesnysis;Kauno policijos mokykla;teisininkas,,Ignalina,Demokratinė darbo ir vienybės partija,lietuvis ,27,,Ne ,Neturiu 
Ignalinos - Švenčionių,1952-07-04,vedęs,Ne ,"LRS kanceliarija,seimo nario padėjėjas-sekretorius",VILIUS    CIBULSKAS,Strigailiškio k.,Aukštasis;Kauno politechnikos institutas;inžinierius - elektromechanikas;1975,"grybavimas, namų ūkio darbai","Šiūlėnų k.,Daugėliškio sen.,Ignalinos r.sav.",Lietuvos socialdemokratų partija,lietuvis ,95,vokiečių pagrindai,Ne ,Neturiu 
Ignalinos - Švenčionių,1961-09-20,vedęs,Ne ,"Lietuvos praminininkų konfederacija,Atstovas Lietuvos Respublikos Seime ir Vyriausybėje",ŠARŪNAS    BIRUTIS,Vilnius,Aukštasis;MRU;Teisė ir valdymas;2003;Aukštasis universitetinis;VU;Ekonomika;1984,"Ekonomika, politinka, etnografija, sportas",Šiauliai,Darbo partija,lietuvis ,15,"anglų, rusų, lenkų",Ne ,Neturiu 
Molėtų - Švenčionių,1964-06-12,vedęs,Ne ,"UAB Neįgaliųjų soc. įmonė ""Ūlos juvelyrų studija"",Direktorius",PAULIUS    ZABIELSKAS,Vilnius,Aukštasis;VISI (VGTU);AT (Automobiliai ir autoūkis);1987,"sportas, sodininkystė, bitininkystė, kelionės .",Marijampolė,Respublikonų partija,lietuvis ,21,"rusų, anglų, lenkų",Ne ,Neturiu 
Molėtų - Švenčionių,1957-11-08,vedęs,Ne ,"UAB ""Melinga"",generalinis direktorius",DANIELIUS    VALIAUGA,Molėtai,Aukštasis;Lietuvos žemės ūkio universitetas;inžinierius-mechanikas;1982,"slidinėjimas, kelionės, žvejyba, dviračiai, krepšinis","Alanta, Molėtų r. savivaldybė",Lietuvos Respublikos liberalų sąjūdis,lietuvis ,130,"rusų, anglų",Ne ,Neturiu 
Molėtų - Švenčionių,1961-03-06,vedęs,Ne ,"Molėtų krašto muziejus,skyriaus vedėjas",JONAS    VAIŠKŪNAS,Kulionių k.,Aukštasis;Vilniaus Universitetas;fizikas-dėstytojas;1984,etninė kultūra,"Papiškės km., Švenčionių sen., Švenčionių sav.",Tautininkų sąjunga,lietuvis ,33,"lenkų, rusų, anglų pagrindai",Ne ,Neturiu 
Molėtų - Švenčionių,1980-01-13,Nenurodė,Ne ,"LR Seimas,LR Seimo narė",ZITA    UŽLYTĖ,Vilnius,Magistro laipsnis;Mykolo Romerio universitetas;Europos Sąjungos politika ir administravimas;2009;Bakalauras;Vilniaus pedagoginis universitetas;Lietuvių kalbos filologija;2005,"Joga, sveika gyvensena, pramoginiai šokiai, menas ir literatūra, floristika, kelionės, tapyba.",Švenčionys,Politinė partija „Sąjunga Taip“,lietuvė ,17,"rusų, anglų, lenkų, vokiečių",Ne ,Neturiu 
Molėtų - Švenčionių,1965-05-13,nenurodė,Ne ,"Vilniaus teritorinė muitinė,vyriausioji inspektorė",LAIMA    ŠALKAUSKIENĖ,Činčikų k.,Aukštasis;Mykolo Riomerio universitetas;teisė ir muitinės veikla;2006,"žvejyba, biliardas, kuriu eilias",Lazidijų rajonas,Lietuvos valstiečių ir žaliųjų sąjunga,lietuvė ,26,"rusų, prancūzų",Ne ,Neturiu 
Molėtų - Švenčionių,1960-10-17,vedęs,Ne ,"LR Seimas,Švietimo, mokslo ir kultūros komiteto pirmininkas",VALENTINAS    STUNDYS,Molėtai,Aukštasis;Vilniaus valstybinis pedagoginis institutas (dabar LEU);Lietuvių k. ir literatūros mokytojas;1982,,"Širvintų raj., Limonių k.",Tėvynės sąjunga - Lietuvos krikščionys demokratai,lietuvis ,13,"rusų, vokiečių",Ne ,Neturiu 
Molėtų - Švenčionių,1965-06-14,vedęs,Ne ,"T. Polito firmas ""ARS"",direktorius",TADEUŠ    POLITO,Spenglo k.,Aukštasis;Sankt Peterburgo muitinės akademija;muitinės brokeris;1999;Aukštesnysis;Lisinos miškininkystės kolegija;Miškų ūkio specialybė;1984,"politika, ekonomika, aplinkos apsauga, kultūra, amatai, medicina...",Vilnius,Demokratinė darbo ir vienybės partija,lenkas ,17,"lenkų, rusų, baltarusų",Ne ,Neturiu 
Molėtų - Švenčionių,1958-03-22,išsituokusi,Ne ,"bedarbė,-",IRENA    MALINAUSKIENĖ,Kaunas,Aukštasis universitetinis;VU;Teisininkė;2003;Aukštasis universitetinis;VU;Ekonomistė;1984,"knygų skaitymas, muzika, kelionės, gamta",Molėtų raj. Gruodžių kaimas,„Drąsos kelias“ politinė partija,lietuvė ,20,"rusų, anglų",Ne ,Neturiu 
Molėtų - Švenčionių,1970-12-15,ištekėjusi,Ne ,"UAB ,,LUCROBERA“,Vyr.technologė",RASA    LUCINAVIČIENĖ,Mažeikių k.,,"knygos, muzika, teatras",Vilnius,Partija Tvarka ir teisingumas,lietuvė ,67,"rusų, lenkų, anglų",Ne ,Neturiu 
Molėtų - Švenčionių,1985-02-18,vedęs,Ne ,"Rimanto Klipčiaus ūkis,savininkas",RIMANTAS    KLIPČIUS,Trūdų k.,Aukštasis universitetinis;VU;Verslo vadyba ir administravimas;2007,"Politika, ekonomika, sportas, knygos",Kaunas,Liberalų ir centro sąjunga,lietuvis ,42,"rusų, anglų, vokiečių",Ne ,Neturiu 
Molėtų - Švenčionių,1959-01-17,vedęs,Ne ,"UAB ""Nemenčinės komunalininkas"",direktorius",ZBIGNEV    JEDINSKIJ,Pabradė,Aukštasis;Kauno politechnikos institutas;inžnierius - mechanikas;1982,"sportas, muzika, žvejyba","Gardinas, Baltarusija",Lietuvos lenkų rinkimų akcija,lenkas ,6,"rusų, lenkų, vokiečių",Ne ,Neturiu 
Molėtų - Švenčionių,1967-09-22,Nenurodė,Ne ,",",PETRAS    ČIMBARAS,Levaniškių k.,,,,Darbo partija, ,43,,Ne ,Neturiu 
Molėtų - Švenčionių,1941-07-01,vedęs,Ne ,"Molėtų ligoninė,gydytojas-chirurgas",STASYS    BAJERČIUS,Sidabrinių k.,Aukštasis;Kauno medicinos institutas;gydytojas;1964,"medžioklė, sportas, knygos",Alytus,Lietuvos socialdemokratų partija,lietuvis ,114,"rusų, anglų",Ne ,Neturiu 
Varėnos - Eišiškių,1959-12-16,vedęs,Ne ,"Varėnos krašto vietos veiklos grupė,projektų koordinatorius",ALVYDAS    VALEIŠA,Naujųjų Valkininkų k.,Aukštasis universitetinis;Aleksandro Stulginskio universitetas;Miškininkas - inžinierius;1983,"meistravimas, knygų skaitymas, politika","Liaukiškių km., Čiobiškio sen., Širvintų raj.",Lietuvos centro partija,lietuvis ,37,,Ne ,Neturiu 
Varėnos - Eišiškių,1960-09-16,vedęs,Ne ,"Viešoji įstaiga Žaliosios politikos institutas, direktorius",GINTARAS    SALDŽIŪNAS,Vilnius,Aukštasis;Vilniaus Universitetas;Biologas;1983,"Sportas, skaitymas, kelionės",Vilnius,Išsikėlė pats,lietuvis ,,"rusų, anglų",Ne ,Neturiu 
Varėnos - Eišiškių,1961-10-05,vedęs,Ne ,"UAB ""GARVILĖ"",direktorius",RIMANTAS    RADŽIUS,Varėna,Aukštasis;Lietuvos veterinarijos akademija;zooinžinierius,"turizmas, sportas",Varėnos rajonas Pamerkių kaimas,Liberalų ir centro sąjunga,lietuvis ,73,"rusų, ukrainiečių",Ne ,Neturiu 
Varėnos - Eišiškių,1963-04-24,netekėjusi,Ne ,"Nedirba,-",RIMA    PAULAUSKAITĖ,Klaipėda,Profesinis;Klaipėdos PTM 41;Dažytoja-tinkuotoja;1982,"Sportas, muzika,",Klaipėda,Demokratinė darbo ir vienybės partija,lietuvė ,66,rusų,Taip ,Neturiu 
Varėnos - Eišiškių,1961-09-01,vedęs,Ne ,"Šalčininkų rajono savivaldybė,meras",ZDZISLAV    PALEVIČ,Šalčininkai,Aukštasis;Vilniaus pedagoginis institutas;mokytojas;1984,"kraštotyra, sportas, muzika","Jančiunų k., Šalčininkų r.",Lietuvos lenkų rinkimų akcija,lenkas ,13,rusų,Ne ,Neturiu 
Varėnos - Eišiškių,1978-05-05,vedęs,Ne ,"Lietuvos Respublikos Seimas,Seimo narys",VYTAUTAS    KURPUVESAS,Vilnius,Aukštasis;Lietuvos teisės universitetas;teisininkas;2002,,Vilniaus raj.,Politinė partija „Sąjunga Taip“,lietuvis ,8,"rusų, lenkų, anglų",Ne ,Neturiu 
Varėnos - Eišiškių,1961-05-28,ištekėjusi,Ne ,"Nacionalinė vaistų prekybos asociacija,Direktorė",JŪRATĖ    KULBERKIENĖ,Vilnius,Aukštasis magistrinis;Klaipėdos universitetas;Viešasis administravimas;2004;Aukštasis universitetinis;kauno medicinos institutas (dabar Lietuvos sveikatos mokslų universitetas);Farmacija;1984,"pažintinės kelionės, knygos","Pagėgiai, Šilutės rajonas",Lietuvos socialdemokratų partija,lietuvė ,29,anglų,Ne ,Neturiu 
Varėnos - Eišiškių,1981-04-11,nevedęs,Ne ,"LR Ministro Pirmininko tarnyba,Ministro Pirmininko patarėjas",LIUTAURAS    KAZLAVICKAS,Vilnius,Aukštasis;Vilniaus universitetas;Istorija;2005,,Vilnius,Tėvynės sąjunga - Lietuvos krikščionys demokratai,lietuvis ,38,"anglų, rusų",Ne ,Neturiu 
Varėnos - Eišiškių,1962-12-20,vedęs,Ne ,"Lietuvos Respublikos Seimas,Seimo narys",ALGIS    KAŠĖTA,Vilnius,Aukštasis universitetinis;Vilniaus universitetas;Istorikas;1991,"Partizaninio karo Lietuvoje 1944-1953 m. tyrinėjimas, literatūra - istorinė, grožinė, muzika - dŽiazas, sportas - tinklinis",Lietuva,Lietuvos Respublikos liberalų sąjūdis,lietuvis ,2,"rusų, lenkų",Ne ,Neturiu 
Varėnos - Eišiškių,1969-06-21,nevedęs,Ne ,"MINDAUGO KARLONO PĮ,Savininkas",MINDAUGAS    KARLONAS,Varėna,Aukštasis;KTU;Radioelektronikos inžinierius;1998,"kelionės, sportas",Ignalina,Respublikonų partija,lietuvis ,52,"rusų, anglų, lenkų",Ne ,Neturiu 
Varėnos - Eišiškių,1986-06-01,netekėjusi,Ne ,"VšĮ Naisių vasaros teatras, aktorė,aktorė",BIRUTĖ    KAKTYTĖ,Šiauliai,Aukštasis;Šiaulių universitetas;aktorė;2009,"kelionės, knygų skaitymas",Mažeikiai,Lietuvos valstiečių ir žaliųjų sąjunga,lietuvė ,103,"anglų, rusų",Ne ,Neturiu 
Varėnos - Eišiškių,1984-06-23,nevedęs,Ne ,"UAB M&amp;KO,Direktorius",MARIUS    JUŠKEVIČIUS,Marcinkonių sen.,aukštasis (numatoma);Aleksandro Stulginskio universitetas;Inžinerinė-vadyba;2014,"Medžioklė, Buriavimas, poilsis gamtoje.",Varėna,Partija Tvarka ir teisingumas,lietuvis ,57,"anglų, rusų",Ne ,Neturiu 
Varėnos - Eišiškių,1958-05-03,vedęs,Ne ,"UAB ""Respublikos leidiniai"",Apžvalgininkas",GEDIMINAS    JAKAVONIS,Glūko k.,Aukštasis;Vilniaus universitetas;Ekonomistas;1981,"Sportas, tautodailė",Varėna,Darbo partija,lietuvis ,33,"rusų, lenkų, prancūzų",Ne ,Neturiu 
Varėnos - Eišiškių,1957-10-30,vedęs,Ne ,"Mykolo Romerio universitetas,lektorius",GEDIMINAS    ALEKSONIS,Kaunas,Aukštasis;TSRS VRM Minsko aukštoji milicijos mokykla;Teisininkas;1984,medžioklė,Varėnos raj.,Krikščionių partija,lietuvis ,16,rusų,Ne ,Neturiu 
Mažeikių,1960-09-21,išsiskyręs,Ne ,"UAB ""Roventa"",Generalinis direktorius",ROMAS    VENCLOVAS,Mažeikiai,Aukštasis;Vilniaus inžinerinis statybos institutas;Pramoninės ir civilinės statybos inžinierius;1992;Aukštesnysis;Plungės statybos technikumas;Pramoninės ir civilinės statybos inžinierius;1980,"Politika, literatūra, gamta, automobiliai, kelionės, televizija","Kretingalė, Klaipėdos rajonas",Darbo partija,lietuvis ,56,"anglų, rusų",Ne ,Neturiu 
Skuodo  - Mažeikių,1966-12-20,vedęs,Ne ,"Skuodo r. savivaldybė,meras",STASYS    VAINORAS,Skuodas,Aukštasis;VPU;mokytojas;1992,"Kelionės, filatelija, folkloras, teatras",Skuodas,Lietuvos Respublikos liberalų sąjūdis,lietuvis ,18,"anglų, rusų",Ne ,Neturiu 
Kretingos,1948-07-29,Nenurodė,Ne ,"VSDF Vilniaus miesto skyrius,informacinių sistemų vyriausiasis specialistas",JURGIS    ZABILIUS,Vilnius,Aukštasis;Vilniaus valstybinis universitetas;Matematikas-kibernetikas;1972;Vidurinis;Darbėnų Jono Šimkaus vidurinė mokykla;1967,"krikščioniška spauda, šachmatai, kelionės, darbas sode.","Kretingos rajonas, Nausėdų kaimas",„Drąsos kelias“ politinė partija,lietuvis ,56,"rusų, prancūzų",Ne ,Neturiu 
Plungės - Rietavo,1957-10-01,vedęs,Ne ,"Vilniaus universitetas,Tarptautinių reikalų prorektorius",RIMANTAS    VAITKUS,Vilnius,"Aukštasis;Vilniaus universitetas;chemija;1980;Vidurinis;Plungės 3-oji vid. mokykla (dabar - ""Saulės"" gimnazija);-;1975","teatras, muzika, fotografija",Plungė,Lietuvos socialdemokratų partija,lietuvis ,45,"anglų, rusų, lenkų",Ne ,Neturiu 
Tauragės,1958-02-10,vedęs,Ne ,"Lietuvos Respublikos Seimas,Seimo narys, Teisės ir teisėtvarkos komiteto pirmininkas",STASYS    ŠEDBARAS,Vilnius,"Aukštasis;Vilniaus universitetas, Teisės fakultetas;teisininkas;1981","Muzika, knygos, medžio darbai","Šilalės (buvęs Skaudvilės) rajonas, Tūjainių kaimas",Tėvynės sąjunga - Lietuvos krikščionys demokratai,lietuvis ,19,"vokiečių, rusų, anglų",Ne ,Neturiu 
Šilalės - Šilutės,1982-05-30,vedęs,Ne ,"LR Seimas,Seimo narys",REMIGIJUS    ŽEMAITAITIS,Vilnius,Aukštasis;VU TEISĖS FAKULTETAS;teisininkas;2005;Vidurinis;ŠILUTĖS PIRMOJI GIMNAZIJA;moksleivis;2000,"SPORTAS, ŽVEJYBA, KELIONĖS, MEDŽIOKLĖ",ŠILUTĖ,Partija Tvarka ir teisingumas,lietuvis ,10,"rusų, anglų",Ne ,Neturiu 
Šilutės - Pagėgių,1966-11-28,vedęs,Ne ,"Lietuvos Respublikos Seimas,Seimo narys, Lietuvos Respublikos Seimo IVP komiteto pirmininkas",ARŪNAS    VALINSKAS,Vilnius,"Aukštasis teisės mokslų magistras;VU, Teisės fakultetas;Teisė;2002",žūklė,Lazdijai,Liberalų ir centro sąjunga,lietuvis ,3,"rusų, anglų",Taip ,Neturiu 
Gargždų,1985-11-04,nevedęs,Taip ,"UAB ""KAUSA EXPEDITION"",Vadovas",EDGARAS    ŽUKAUSKAS,Klaipėda,Aukštasis;Tarptautinė teisės ir verslo aukštoji mokykla;transporto vadybininkas/logistika;2009,,Klaipėda,Demokratinė darbo ir vienybės partija,lietuvis ,50,"rusų, anglų",Taip ,Neturiu 
Alytaus,1956-02-10,išsituokusi,Ne ,"laikinai nedirbu,",NIJOLĖ    VIŠKELIENĖ,Pašilaičiai,Aukštesnysis;Vilniaus statybos technikumas;technikas technologas;1976,sportas,Vilnius,Demokratinė darbo ir vienybės partija,lietuvė ,67,"rusų, anglų, lenkų",Ne ,Neturiu 
Marijampolės,1961-10-27,vedęs,Ne ,"Vilniaus miesto savivaldybės administracija,Socialinių reikalų ir sveikatos departamento direktorius",GINTARAS    ŽANDARAVIČIUS,Asiūklės vs.,Aukštasis;VU;bibliografas;1985,"kelionės, skaitymas, sportas",Kaunas,Politinė partija „Sąjunga Taip“,lietuvis ,54,"rusų, lenkų",Ne ,Neturiu 
Aukštaitijos,1965-11-22,vedęs,Ne ,"Panevėžio rajono savivaldybės administracija,vyriausiasis specialistas",REMIGIJUS    VILYS,Panevėžys,Aukštasis;Vilniaus dailės akademija. UNESCO katedra;kultūros vadybos ir politikos magistras;2005;Aukštasis;Vilniaus pedagoginis universitetas;muzikos edukologijos magistras;2002;Aukštasis;Lietuvos muzikos akademija;klarnetas ir dirigavimas;1991,"muzika, menas, knygos, turizmas, projektinė veikla.",Panevėžys,Lietuvos valstiečių ir žaliųjų sąjunga,lietuvis ,58,"anglų, rusų",Ne ,Neturiu 
Vakarinė,1972-10-08,vedęs,Ne ,"V.Vaitkevičiaus įm.,savininkas",VAIDOTAS    VAITKEVIČIUS,Panevėžys,Aukštesnysis;Algirdo Andrišiūno aukštesnioji vadybos mokykla;Verslo organizavimo;1997;Aukštasis;KTU Panevėžio institutas;Mechanikos inžinerijos;1111,"kelionės,",Vilnius,Politinė partija „Sąjunga Taip“, ,52,"rusų, anglų",Ne ,Neturiu 
Nevėžio,1953-04-23,vedęs,Ne ,"Panevėžio kolegija,psichologijos, etnokultūros dėstytojas, bendrabučio valdytojas",LAIMUTIS    VASILEVIČIUS,Panevėžys,Aukštasis;Leningrado I.Gerceno vardo pedagoginis institutas;surdopedagogika;1976,"kraštotyra, etnokultūros tyrinėjimai ir praktika, mitologiniai akmenys, pirtis",Panevėžys,Tautininkų sąjunga,lietuvis ,64,rusų,Ne ,Neturiu 
Dainų,1944-02-20,vedęs,Ne ,"VĮ Tarptautinis Palangos oro uostas,direktoriaus pavaduotojas",VLADIMIR    VLASOV,Klaipėda,Aukštasis;Kaliningrado technikos institutas;inžinierius - elektromechanikas;1984,sportas,"Rostovo sritis, Rusija",Lietuvos lenkų rinkimų akcija,rusas ,17,rusų,Ne ,Neturiu 
Saulės,1958-07-31,ištekėjusi,Ne ,"kūrybinė veikla pagal individualios veiklos pažymą,-",IRENA    VASINAUSKAITĖ,Šiauliai,Vidurinis;Šiaulių Juliaus Janonio vidurinė;Nenurodė;1976,atgimimo laikotarpio istorinės atminties išsaugojimas,"Latvija, Bauskės raj. Libijiešsko km.",„Drąsos kelias“ politinė partija,lietuvė ,38,"rusų, anglų",Ne ,Neturiu 
Aušros,1952-05-25,vedęs,Ne ,"Lietuvos Respublikos Seimas,Seimo narys",EDVARDAS    ŽAKARIS,Šiauliai,Aukštasis;Šiaulių K.Preikšo pedagoginis institutas;tiflopedagogas;1988;Aukštasis;Lietuvos žemės ūkio akademija;ekonomistas - organizatorius;1985,"muzika, sportas, literatūra","Pagėgių km.,Šilutės raj.",Lietuvos socialdemokratų partija,lietuvis ,16,rusų,Ne ,Neturiu 
Pajūrio,1957-02-05,vedęs,Ne ,"Lietuvos Respublikos Seimas,Seimo narys",PRANAS    ŽEIMYS,Palanga,Aukštasis;Leningrado civilinės aviacijos akademija;Skrydžių valdymo inžinierius;1987,"elektronika, aviacija, programavimas","Barzdžių kaimas, Kretingos rajonas",Tėvynės sąjunga - Lietuvos krikščionys demokratai,lietuvis ,45,"rusų, anglų",Ne ,Neturiu 
Pajūrio,1970-05-26,vedęs,Ne ,"Savaitraštis „Atgimimas“ (dirbu tik pagal autorinę sutartį)
Pareigos: politikos, visuomenės, kultūros ir religijos gyvenimo apžvalgininkas",TOMAS    VILUCKAS,Palanga,,"Kinas, sportas, muzika, teologija, filosofija, psichologija, knygos",Palanga,„Drąsos kelias“ politinė partija,lietuvis ,19,"prancūzų, rusų, anglų, lotynų",Ne ,Neturiu 
Pajūrio,1976-12-20,ištekėjusi,Ne ,"Klaipėdos miesto savivaldybės administracija,Administracijos direktoriaus pavaduotoja",ALINA    VELYKIENĖ,Klaipėda,Magistras;Klaipėdos universitetas;Rinkodaros vadyba;2000;Bakalauras;Šiaulių universitetas;Verslo vadyba ir administravimas;1998,"muzika, dailė, vandens turizmas, kelionės",Šilutės miestas,Lietuvos Respublikos liberalų sąjūdis,lietuvė ,21,"anglų, rusų",Ne ,Neturiu 
Pajūrio,1974-10-25,vedęs,Ne ,"Palangos kultūros centras,direktoriaus pavaduotojas",NERIJUS    STASIULIS,Palanga,Vidurinis;Palangos V. Jurgučio vidurinė mokykla;abiturientas;1993,,"Tūbausių km., Kretingos raj.",Lietuvos centro partija,lietuvis ,25,"rusų, anglų",Ne ,Neturiu 
Pajūrio,1974-03-12,ištekėjusi,Ne ,"UAB ""Klaipėdos autobusų parkas"",Planavimo ir kontrolės skyriaus viršininkė",JULIJA    PLIUTIENĖ,Klaipėda,Aukštasis;Kaliningrado valstybinis technikos universitetas;ekonomistė;2007,"kelionės, sportas, muzika","Klaipėda, Lietuva",Lietuvos lenkų rinkimų akcija,lietuvė ,50,"rusų, anglų",Ne ,Neturiu 
Pajūrio,1981-03-14,vedęs,Ne ,"Šilutė,Jaunasis ūkininkas",DANAS    PALUCKAS,Palanga,Aukštasis;Klaipėdos Universitetas;Ekonomistas;2009,"Žvejyba, medžioklė, kelionės",Panevėžys,Lietuvos socialdemokratų partija,lietuvis ,66,,Taip ,Neturiu 
Pajūrio,1957-10-23,vedęs,Ne ,"Liberalų ir Centro Sąjunga,atsakingasis sekretorius",RAIMUNDAS    PALAITIS,Palanga,Aukštasis;VU;Matematikas;1980,"muzika, kalnų slidinėjimas",Palanga,Liberalų ir centro sąjunga,lietuvis ,2,"anglų, rusų, lenkų",Ne ,Neturiu 
Pajūrio,1960-07-22,vedęs,Ne ,"nedirbu,Partijos Tvarka ir Teisingumas Pajūrio skyriaus pirmininkas",PRANAS    NORVILAS,Kvietinių k.,Magistras;Klaipėdos universitetas;Dvasinis konsultavimas;2013;Aukštasis;Klaipėdos universitetas;Verslo vadyba;2009;Aukštesnysis;Klaipėdos TŪT;veterinarija;1983,"automobiliai, turizmas, dviračiai","Plungės rajonas, Rietavo apylinkė, Girdvainių kaimas",Partija Tvarka ir teisingumas,lietuvis ,56,"rusų, prancūzų",Ne ,Neturiu 
Pajūrio,1973-05-12,vedęs,Ne ,"LR Aplinkos ministerija Valstybinė miškų tarnyba,Klaipėdos teritorinio poskyrio vedėjas",ERNESTAS    LUČAUSKAS,Kretingsodžio k.,Aukštasis magistrinis;Lietuvos žemės ūkio universitetas;miškininkystė;1999,"kelionės, burlenčių sportas, joga","Kauno m., Lietuva",Lietuvos valstiečių ir žaliųjų sąjunga,lietuvis ,34,"rusų, anglų",Ne ,Neturiu 
Pajūrio,1967-06-15,nenurodė,Ne ,"Antikvarinių baldų salonas,Administratorė",DAINA    LINGIENĖ,Klaipėda,Aukštasis universitetinis;Klaipėdos universitetas;Psichologija-pedagogika;1993,"Antikvarinės vertybės, sveikas gyvenimo būdas, ekologija",Klaipėda,Respublikonų partija,lietuvė ,72,rusų,Ne ,Neturiu 
Pajūrio,1961-11-06,ištekėjusi,Ne ,",",VILMA    KVIETKAUSKIENĖ,Neringa,Aukštasis;Vilniaus universiteto Tarptautinio verslo mokykla;Vadybininkė;2001,"politika, sportas, dainavimas",Klaipėda,Demokratinė darbo ir vienybės partija,lietuvė ,2,"anglų, rusų",Ne ,Neturiu 
Pajūrio,1952-02-13,ištekėjusi,Ne ,"Klaipėdos valstybinė kolegija,Lektorė",GENOVEITA    KRASAUSKIENĖ,Palanga,Aukštasis;Kauno technologijos universitetas;Viešasis administravimas;2004;Aukštasis;Vilniaus universitetas;Filologė ir anglų kalbos dėstytoja;1976,"Laisvalaikiu mėgstu skaityti knygas, domiuosi psichologija, mėgstu aktyvų poilsį gamtoje","Kaukolikų k., Skuodo raj.",Darbo partija,lietuvė ,64,"anglų, rusų, vokiečių",Ne ,Neturiu 
Pajūrio,1965-03-26,vedęs,Ne ,"Asociacija ""Jūrų šaulys"",Saugos tarnybos vadovo pavaduotojas",ARAS    KAIKARIS,Klaipėda,"Aukštasis universitetinis;Vilniaus universitetas;Istorikas, istorijos dėstytojas;1991;Spec. techninis;Klaipėdos 14-oji technikos mokykla;Suvirintojas elektra;1984","Istorija, knygos, muzika, dviračių sportas, medžioklė",Klaipėda,Politinė partija „Sąjunga Taip“,lietuvis ,48,"anglų, rusų",Ne ,Neturiu 
Pajūrio,1960-10-06,netekėjusi,Ne ,"individuali veikla,",ALA    GUSEVA,Klaipėda,Aukštasis neuniversitetinis;Klaipėdos valstybinė kolegija;Kineziterapeutas;2006,"Sportas, medicina",Klaipėda,Lietuvos žmonių partija,rusė ,10,rusų,Ne ,Neturiu 
Aušros,1971-05-20,vedęs,Ne ,"Advokatų kontora ""Vinkleris ir partneriai"",advokatas",PAULIUS    VINKLERIS,Vilnius,Magistro laipsnis;Kylio universitetas;Teisininkas;1999;Aukštasis;VU Teisės fakultetas;Teisininkas;1994;Aukštasis;VU Tarptautinių santykių ir politikos mokslų institutas;Tarptautinių santykių specialistas;1994,"muzika, menas, gamta, malda, užsienio kelionės",Kaunas,„Drąsos kelias“ politinė partija,lietuvis ,43,"anglų, vokiečių, rusų",Ne ,Neturiu 
Aušros,1958-03-26,vedęs,Ne ,"Lietuvos Respublikos Seimas,Seimo narys",EGIDIJUS    VAREIKIS,Bendorių k.,Aukštasis;Vilniaus universitetas;Bioorganinė chemija;1981,"Futbolas, klasikinė muzika, ruoniai","Kaunas, Lietuva",Tėvynės sąjunga - Lietuvos krikščionys demokratai,lietuvis ,27,"anglų, lenkų, rusų, vokiečių, prancūzų, kinų, slovakų, serbų",Ne ,Neturiu 
Aušros,1986-07-18,vedęs,Ne ,"UAB ""Šilumos šaltinis"",Projektuotojas",TADAS    VALKIŪNAS,Šiauliai,"Magistro laipsnis;Vilniaus Gedimino technikos universitetas;Šiluminė energijos inžinerija;2012;Bakalauro laipsnis;Vilniaus Gedimino technikos universitetas;Energetika;2009;Meno mokykla;Šiaulių „Dagilėlio"" dainavimo mokykla;Dainavimas;2002","sportas, turizmas, žvejyba, muzika",Šiauliai,Respublikonų partija,lietuvis ,38,"anglų, rusų",Ne ,Neturiu 
Aušros,1958-05-23,Nenurodė,Ne ,"UAB Salduvės viešbutis,direktorius",KĘSTUTIS    VAIŠVILA,Šiauliai,Aukštasis;Šiaulių universitetas;inžinierius;2004;Aukštasis;Šiaulių pedagoginis institutas;pedagogas;1981,"Sportas, žvejyba, kelionės",Šiauliai,Politinė partija „Sąjunga Taip“,lietuvis ,83,"anglų, rusų",Ne ,Neturiu 
Aušros,1969-06-04,ištekėjusi,Ne ,"Šiaulių valstybinė kolegija,asistentė",FAUSTA    SMOLENSKIENĖ,Šiauliai,Aukštasis;Šiaulių universitetas;Ekonomika;2008,"kelionės, knygos, stalo žaidimai",Šiauliai,Krikščionių partija,lietuvė ,51,"rusų, anglų",Ne ,Neturiu 
Aušros,1946-11-27,vedęs,Ne ,"Šiaulių universitetas,elektronikos katedros profesorius",VINCAS    LAURUTIS,Šiauliai,Aukštasis;KPI (KTU);Radijo inžinierius;1969,kelionės,Šiauliai,Liberalų ir centro sąjunga,lietuvis ,33,"anglų, rusų",Ne ,Neturiu 
Aušros,1966-03-04,nevedęs,Taip ,",",EDVARDAS    KUVIKAS,Šiauliai,Aukštasis;Kauno Technologijos Universitetas;inžinierius;1994,"gamta, kelionė, sportas, kinas, knygos",Šiauliai,Lietuvos socialdemokratų sąjunga,lietuvis ,49,"rusų, anglų",Taip ,Neturiu 
Aušros,1967-07-21,vedęs,Ne ,"Šiaulių r. PSPC Meškuičių palaikomojo gydymo ir slaugos ligoninė,Vyriausiasis gydytojas",DARIUS    KRIŠTAPONIS,Aukštelkės k.,Aukštasis (magistratūros I kursas);Mykolo Romerio universitetas;sveikatos vadyba;2009;Aukštasis;Vilniaus universitetas;šeimos gydytojas;2000;Aukštasis;Kauno  medicinos akademija;medicinos gydytojas;1994,medžioklė,Šiaulių miestas,Lietuvos Respublikos liberalų sąjūdis,lietuvis ,76,"rusų, anglų",Ne ,Neturiu 
Aušros,1985-10-03,vedęs,Ne ,"UAB ""Sanda"",Meistras",MINDAUGAS    KIESAS,Šiauliai,Aukštasis;Šiaulių universitetas;Aplinkos inžinerija,"Aktyvi veikla, sportas, muzika ir kelionės",Šiauliai,Darbo partija,lietuvis ,78,"anglų, rusų, vokiečių",Ne ,Neturiu 
Aušros,1986-03-29,netekėjusi,Ne ,"Naisių vasaros teatras,aktorė",VAIDA    KAVALIAUSKAITĖ,Šiauliai,aukštasis universitetinis bakalauras;Šiaulių universitetas;aktorė;2009,"kūryba, skaitymas, kelionės",Joniškis,Lietuvos valstiečių ir žaliųjų sąjunga,lietuvė ,39,"anglų, rusų",Ne ,Neturiu 
Aušros,1976-09-06,vedęs,Ne ,"UAB Designbygg LT,Direktorius",TOMAS    JAKAVIČIUS,Šiauliai,Aukštasis;Šiaulių Universitetas;PUP ir Darbu mokytojas;1998,,Joniskis,Partija Tvarka ir teisingumas,lietuvis ,78,"anglų, rusų",Ne ,Neturiu 
Aušros,1970-05-10,ištekėjusi,Ne ,"Šiaulių respublikinė ligoninė - akių ligų skyrius,slaugytoja",ALMA    BAGDONAVIČIENĖ,Šiauliai,Aukštasis;Klaipėdos universitetas;slaugytoja;2010,turizmas,Šiauliai,Lietuvos lenkų rinkimų akcija,lietuvė ,23,"rusų, vokiečių",Ne ,Neturiu 
Saulės,1986-09-30,nevedęs,Ne ,"Naisių vasaros teatras,aktorius",VALDAS    VAITIŠKIS,Šiauliai,aukštasis universitetinis bakalauras;Šiaulių universitetas;aktorius;2009,"muzikavimas, kelionės dviračiu, skaitymas",Šiauliai,Lietuvos valstiečių ir žaliųjų sąjunga,lietuvis ,114,"anglų, rusų",Ne ,Neturiu 
Saulės,1976-02-23,išsiskyręs,Ne ,"LR Seimas, Seimo narys",ANDRIUS    ŠEDŽIUS,Šiauliai,"Aukštasis, magistrantūra;Šiaulių universitetas;Vadyba - verslas;2006;Aukštasis, bakalauras;Šiaulių universitetas;Verslo ekonomika;2004", narys,Šiauliai,Išsikėlė pats,lietuvis ,,"anglų, rusų, vokiečių",Ne ,Neturiu 
