apygarda,gimimo_data,seimynine_padetis,sunkus_nusikaltimas,darboviete,kandidatas,gyvena,issilavinimas,pomegiai,gimimo_vieta,iskele,tautybe,saraso_numeris,uzsienio_kalbos,pripazintas_kaltu,neatlikta_bausme
Fabijoniškių,1952-06-29,vedęs,Ne ,"Lietuvos Respublikos Seimas,Seimo narys",DAILIS ALFONSAS    BARAKAUSKAS,Vilnius,Universitetinis;Vilniaus universitetas;Tarptautiniai ekonominiai santykiai;1990;Universitetinis;Kauno politechnikos institutas;Mašinų gamybos technologinių procesų automatizavimas;1975,"sodo darbai, Lietuvos meno istorija, žūklė",Pakruojo rajono Geručių kaimas,Partija Tvarka ir teisingumas,lietuvis ,7,"anglų, rusų, latvių",Ne ,Neturiu 
Fabijoniškių,1964-05-20,vedęs,Ne ,"UAB ""TIRHAN"",vairuotojas-ekspeditorius",TIRKIŠAS    AMANOVAS,Lentvaris,,žvejyba,Turkmenistanas,Kovotojų už Lietuvą sąjunga, ,,"rusų, turkmėnų",Taip ,Neturiu 
Šeškinės,1951-07-02,vedęs,Ne ,"Lietuvos Respublikos susisiekimo ministerija,viceministras",ARŪNAS    ŠTARAS,Vilnius,Matematikos mokslų daktaras;Maskvos M. Lomonosovo universitetas;taikomoji matematika;1978;Aspirantūra;Maskvos M. Lomonosovo universitetas;taikomoji matematika;1977;Aukštasis;Vilniaus universitetas;matematika;1974,"teatras, kelionės","Žagarė, Joniškio raj.",Lietuvos Respublikos liberalų sąjūdis,lietuvis ,13,"anglų, rusų, lenkų, čekų",Ne ,Neturiu 
Šeškinės,1954-03-05,vedęs,Ne ,"Lietuvos Respublikos Seimas,Seimo narys",ALGIRDAS    SYSAS,Vilnius,Aukštasis;Vilniaus universitetas;ekonomistas;1982,"sportas, muzika",1954-03-05,Lietuvos socialdemokratų partija,lietuvis ,8,"rusų, lenkų, anglų",Ne ,Neturiu 
Šeškinės,1948-09-09,Nenurodė,Ne ,",",GEDIMINAS    RUDŽIONIS,Vilnius,,,,Partija Tvarka ir teisingumas, ,29,rusų,Ne ,Neturiu 
Šeškinės,1965-02-08,ištekėjusi,Ne ,"-,-",ASTA    NAZAROVIENĖ,Vilnius,,-,Vilnius,Krikščionių partija,lietuvė ,35,"rusų, lenkų",Ne ,Neturiu 
Šeškinės,1960-01-18,vedęs,Ne ,"Vilniaus r. Nemėžio Šv. Rapolo Kalinausko gimnazija,direktorius",ZBIGNIEV    MACIEJEVSKI,Vilnius,"Aukštasis universitetinis;Vilniaus universitetas;Chemikas, dėstytojas;1983",,Vilnius,Lietuvos lenkų rinkimų akcija,lenkas ,18,rusų,Ne ,Neturiu 
Šeškinės,1962-11-12,vedęs,Ne ,"V.Lazinka P.Į,savininkas",VYTAUTAS ALEKSAS    LAZINKA,Vilnius,Aukštasis;MNJI;teisė;2003;Aukštasis;VGTU;transporto inžinierija;2000,"medžioklė,žvejyba",Vilnius,Lietuvos žmonių partija,lietuvis ,12,"rusų, lenkų",Ne ,Neturiu 
Šeškinės,1963-08-26,nevedęs,Ne ,"Lietuvos Respublikos Seimas,Lietuvos Respublikos Seimo narys",LIGITAS    KERNAGIS,Jonava,Aukštasis;Kauno politechnikos institutas;Elektros tiekimas;1986,"Muzika, sportas, kelionės","Panevėžio raj., Lietuva",Politinė partija „Sąjunga Taip“,lietuvis ,5,"anglų, rusų",Ne ,Neturiu 
Šeškinės,1948-11-21,vedęs,Ne ,",",VYTAUTAS    GRICIUS,Vilnius,Aukštasis;Lietuvos žemės ūkio akademija;Ekonomistas;1972,"Mėgstu keliauti, būti gamtoje. Žaviuosi Lietuvos dailininkų kūriniais, klasikine, šiuolaikine muzika ir džezu","Salantai, Kretingos raj.",Darbo partija,lietuvis ,57,"rusų, anglų, prancūzų",Ne ,Neturiu 
Šeškinės,1980-04-08,nevedęs,Ne ,"Gamtos tyrimų centras,biologas",ANDREJUS    GAIDAMAVIČIUS,Januliškio k.,Magistras;Vilniaus universitetas;Biologija;2004;Doktorantūros studijos;Geologijos ir geografijos institutas;Geologija;2004;Bakalauras;Lietuvos žemės ūkio universitetas;Miškotyra;2002,"fotografija, antikvarinės knygos","Januliškio k., Labanoro sen., Švenčionių r.",Lietuvos valstiečių ir žaliųjų sąjunga, ,94,"anglų, vokiečių, rusų, lenkų",Ne ,Neturiu 
Šeškinės,1956-08-20,vedęs,Ne ,"Vilniaus Gedimino technikos universitetas,Docentas",REGIMANTAS    ČIUPAILA,Vilnius,Aukštasis;VU;Matematikos dėstytojas;1979,-,Kaunas,Liberalų ir centro sąjunga,lietuvis ,11,"anglų, rusų, lenkų",Ne ,Neturiu 
Šeškinės,1966-05-30,vedęs,Ne ,",",LIUDAS    BRADAUSKAS,Vilnius,"Aukštasis;VPU;Ekonomika, verslo cvadyba;2007",,Vilnius,Lietuvos socialdemokratų sąjunga,lietuvis ,34,"rusų, lenkų",Ne ,Neturiu 
Šeškinės,1981-01-09,vedęs,Ne ,"UAB ""Stasio ratai"",Direktoriaus pavaduotojas",LAIMIS    BIKAUSKAS,Vilnius,aukštasis universitetinis magistras;Vilniaus Gedimino technikos universitetas;Mechanikos inžinerija;2007;aukštasis universitetinis bakalauras;Vilniaus pedagoginis universitetas;Ekonomika;2006,"Sportas, teatras, muzika, felinologija",Vilnius,Respublikonų partija,lietuvis ,48,"anglų, vokiečių, lenkų, rusų",Ne ,Neturiu 
Šeškinės,1958-01-17,vedęs,Ne ,"Lietuvos Užsienio reikalų ministerija,ministras",AUDRONIUS    AŽUBALIS,Vilnius,"Aukštasis;Macalester College World Press Institute (St.Paulas, Minesota, JAV);----------;1990;Aukštasis;Vilniaus Valstybinis universitetas (dabar Vilniaus universitetas);žurnalistika;1989;Vidurinis;Vilniaus Antano Vienuolio vidurinė mokykla (dabartinė Vytauto Didžiojo gimnazija);------------;1976","Idealus laisvalaikis man reiškia paprastas akimirkas kartu su šeima - žmona ir dukromis. Taip pat mėgstu atsiversti gerą istorinę knygą, nueiti į koncertą, įkvėpti gryno oro gamtoje, fizškai padirbėti sodyboje ar pažvejoti.",Vilnius,Tėvynės sąjunga - Lietuvos krikščionys demokratai,lietuvis ,8,"anglų, rusų",Ne ,Neturiu 
Šeškinės,1976-09-20,išsituokusi,Ne ,"UAB „Europetraders group“,buhalterė",JOLITA    ALEKSEJŪNIENĖ,Vilnius,Aukštasis universitetinis;Vilniaus universitetas;Vadybos ir verslo administarvimas;2011;Aukštasis neuniversitetinis;Vilniaus kolegija;Buhalterinė apskaita;2006;Aukštesnysis;VALPM;Siuvinių konstravimas;1998,"kelionės, šokiai, mezgimas",Vilnius,Demokratinė darbo ir vienybės partija,lietuvė ,25,"rusų, vokiečių",Ne ,Neturiu 
Justiniškių,1955-01-25,išsituokusi,Ne ,"VšĮ Vilko valia,direktorė",RŪTA    VANAGAITĖ,Vilnius,Aukštasis;Maskvos V.Lunačiarskio teatro meno institutas;teatrologija;1976,"dviračių sportas, slidinėjimas, žvejyba",Šiaulių miestas,Politinė partija „Sąjunga Taip“,lietuvė ,7,"anglų, rusų, lenkų, suomių, prancūzų",Ne ,Neturiu 
Justiniškių,1949-07-03,vedęs,Ne ,",",EDMUNDAS    VAITEKŪNAS,Vilnius,Aukštasis;VU Komunikacijos fakulteto Žurnalistikos institutas;Ryšiai su visuomene ir atstovas spaudai;2004;Aukštasis;Klaipėdos muzikos fakultetas;Mokytojas;1972;Aukštasis;Šiaulių pedagoginis institutas;Mokytojas;1971,"Šiaulių m. Big Band orkestro dirigentas, dailė, autosportas",Šiauliai,Darbo partija,lietuvis ,95,"rusų, anglų",Ne ,Neturiu 
Justiniškių,1983-04-22,nevedęs,Ne ,"VšĮ Vale Tudo fighting network,Direktorius",ARTEMIJ    SITENKOV,Vilnius,Aukštasis;MRU;Viešasis administravimas;2005,"Kelionės, skaitymas",Vilnius,Respublikonų partija,rusas ,70,"anglų, rusų",Ne ,Neturiu 
Justiniškių,1979-03-13,vedęs,Ne ,"Lietuvos Respublikos Seimas,Seimo narys",PAULIUS    SAUDARGAS,Vilnius,Aukštasis;Vilniaus universitetas;Biofizika;2003;Aukštasis;Vilniaus universitetas;Fizika;2001,"skaityti, mąstyti, rašyti ir veikti",Kaunas,Tėvynės sąjunga - Lietuvos krikščionys demokratai,lietuvis ,9,"rusų, lenkų, anglų",Ne ,Neturiu 
Justiniškių,1962-08-01,vedęs,Ne ,"Lietuvos Respublikos Sveikatos apsaugos ministerija,Kancleris",RIMANTAS    REMEIKA,Vilnius,Aukštasis;Vilniaus pedagoginis universitetas;Socialinis pedagogas;1996;Aukštasis;Vilniaus pedagoginis institutas;Techninių disciplinų ir darbų mokytojas;1985,-,"Sereikių km., Šiaulių raj.",Liberalų ir centro sąjunga,lietuvis ,20,"rusų, anglų",Ne ,Neturiu 
Justiniškių,1948-10-19,vedęs,Ne ,"LR Seimas,Seimo narys",GEDIMINAS    NAVAITIS,Vilnius,Aukštasis;Vilniaus Universitetas;psichologija;1974,"meditacija, strateginiai stalo žaidimai",Vilnius,Išsikėlė pats,lietuvis ,10,"vokiečių, rusų",Ne ,Neturiu 
Justiniškių,1957-12-11,našlys,Ne ,"UAB Emilio,direktorius",EMILIS    MIKELĖNAS,Vilnius,Aukštesnysis;Kauno kolegija;teisininkas;2004;Aukštesnysis;Vilniaus technologijos technikumas;technikas-mechanikas;1976,"Esperanto, Transerfingas",Vilnius,Lietuvos žmonių partija,lietuvis ,33,"anglų, rusų, lenkų",Ne ,Neturiu 
Justiniškių,1952-07-31,vedęs,Ne ,"VŠĮ ""Krantas"",direktorius",VYTAUTAS ANTANAS    MATULEVIČIUS,Vilnius,Aspirantūra;Visuomeninių mokslų akademija;estetika;1989;Aukštasis;VU;žurnalistika;1975,"kūryba, gamta, spiningavimas","Šilavoto kaimas, Prienų rajonas",„Drąsos kelias“ politinė partija,lietuvis ,9,"rusų, lenkų, anglų",Ne ,Neturiu 
Justiniškių,1959-07-13,ištekėjusi,Ne ,"Vilniaus mokykla-darželis ""Vilija"",direktorė",SOFIJA    MATAREVIČ,Vilnius,Aukštasis;Šiaulių pedagoginis universitetas;pradini ugdymo pedagogė;2005;Aukštasis;Vilniaus pedagoginis universitetas;socialinių mokslų magistrė;1996;Aukštasis;Vilniaus pedagoginis universitetas;pedagogikos ir psichologijos dėstytoja;1983,"turizmas, istorija, muzika","Volkovščizna k., Gardino srt., Baltarusija",Lietuvos lenkų rinkimų akcija,lenkė ,58,"rusų, anglų",Ne ,Neturiu 
Justiniškių,1970-09-24,išsituokusi,Ne ,",",SVETLANA    MARTINKO,Vilnius,,,Vilniaus raj.,Demokratinė darbo ir vienybės partija,lenkė ,39,"rusų, lenkų",Ne ,Neturiu 
Justiniškių,1967-07-08,vedęs,Ne ,"UAB Pharmacels Corporation,Direktorius",LINAS    KVEDARAVIČIUS,Vilnius,Aukštasis;Mykolo Riomerio Universitetas;Teisininkas;1999,"Krepšinis, žvejyba",Vilnius,Lietuvos Respublikos liberalų sąjūdis,lietuvis ,22,"rusų, anglų",Ne ,Neturiu 
Justiniškių,1951-08-30,vedęs,Ne ,"LR Seimas,Seimo narys",GEDIMINAS    KIRKILAS,Vilnius,Vadybos ir verslo administravimo magistras;VU TVM;Vadybos ir verslo administracija;2004,"žvejyba, tenisas",Vilnius,Lietuvos socialdemokratų partija,lietuvis ,13,"anglų, rusų",Ne ,Neturiu 
Justiniškių,1944-08-14,vedęs,Ne ,"Vaikų ligoninė Vilniaus universiteto ligoninės Santariškių klinikų filialas,direktoriaus pavaduotojas infrastruktūrai",ALGIMANTAS    JUOCEVIČIUS,Vilnius,"Aukštasis universitetinis;Kauno Politechnikos institutas;Inžinierius statybinikas(šilumos,dujų tiekimas);1968","sportas, istorinė literatūra,grybavimas, darbas",Prienai,Partija Tvarka ir teisingumas,lietuvis ,49,"rusų, anglų",Ne ,Neturiu 
Justiniškių,1960-03-06,ištekėjusi,Ne ,"Nacionalinė visuomenės sveikatos priežiūros laboratorija (NVSPL),Mikrobiologinių tyrimų skyriaus vedėja",RŪTA    JANKAUSKIENĖ,Vilnius,"Doktorantūros studijos;Tartu universiteto Med. f-to Mikrobiologijos k-dra, Bendrosios ir molekulinės patologijos institutas;Mikroorganizmų ekologija ir fiziologija;1987;Aukštasis universitetinis;VU Gamtos mokslų fakultetas;Biologė-mikrobiologė, biologijos ir chemijos dėstytoja;1983","Skaitymas, mąstymas, aktyvi veikla, poezija, dailė, kulinarija",Ignalinos miestas,Krikščionių partija,lietuvė ,45,"lenkų, rusų, anglų, vokiečių",Ne ,Neturiu 
Karoliniškių,1983-08-16,vedęs,Ne ,"Lietuvos Respublikos Seimas,Seimo nario padėjėjas - sekretorius",VALDAS    SKARBALIUS,Jonava,Aukštasis;Kauno verslo kolegija;Tarptautinė verslo vadyba,,Kaunas,Darbo partija,lietuvis ,18,"anglų, rusų",Ne ,Neturiu 
Karoliniškių,1976-06-05,Nenurodė,Ne ,",",ALMANTAS    PETKUS,Vilnius,Telšių rajono savivaldybės tarybos narys;2004 - 2007;Telšių rajono savivaldybės meras;2007 - 2008;X Seimo narys;2008 - 2012,,Telšiai,Partija Tvarka ir teisingumas,lietuvis ,15,"rusų, vokiečių",Ne ,Neturiu 
Karoliniškių,1982-05-13,nevedęs,Ne ,"EUROGEMS LT socialinių iniciatyvų asociacija,prezidentas",MANTAS    PANAVAS,Meiluškių k.,Bakalauras;LEU SKI;Soc. pedagogas;2012,-,Vilnius,Liberalų ir centro sąjunga,lietuvis ,39,"rusų, anglų",Taip ,Neturiu 
Karoliniškių,1963-11-30,vedęs,Ne ,"Mykolo Romerio Universitetas,dėstytojas",ALVYDAS    MEDALINSKAS,Vilnius,Aukštasis;Londono aukštoji ekonomikos mokykla;tarptautinių santykių magistras;1992;Aukštasis universitetinis;Vilniaus valstybinis universitetas;ekonomistas;1985;Vidurinis;Vilniaus 41-oji vid. mokykla (dabar Karoliniškių gimnazija);abiturientas;1981,"knygos, teatras, muzika, pažinti savo ir kitus kraštus",Vilnius,Lietuvos centro partija,lietuvis ,2,"anglų, rusų",Ne ,Neturiu 
Karoliniškių,1961-10-25,ištekėjusi,Ne ,"UAB Vilniaus Sigmos partneris,vyriausioji finansininkė",ANGELINA    LABANAUSKIENĖ,Vilnius,Aukštasis;VU;buhalterinė apskaita ir ūkinės veiklos analizė;1985,"skaitymas,muzika,pažintinės kelionės,renginiai",Skuodo raj.Gricaičių km.,Lietuvos žmonių partija,lietuvė ,25,"rusų, vokiečių, anglų, lenkų",Ne ,Neturiu 
Karoliniškių,1969-08-06,ištekėjusi,Ne ,"Vilniaus rajono savivaldybė,mero patarėja",VANDA    KRAVČIONOK,Vilnius,Aukštasis universitetinis;Humanitarinių ir ekonomikos mokslų akademija Lodzėje;globos ir ugdymo pedagogika;2009,skaitymas,"Šilėnų k., Vilniaus r.",Lietuvos lenkų rinkimų akcija,lenkė ,5,rusų,Ne ,Neturiu 
Karoliniškių,1961-02-11,išsituokusi,Ne ,"VšĮ Karoliniškių poliklinika,Kineziterapeutė",ALBINA    KAVALIAUSKAITĖ,Vilnius,Aukštasis universitetinis;Lietuvos valstybinis kūno kultūros institutas;Kūno kultūros dėstytoja;1986,"Žmogaus teisių gynyba, kelionės, muzika",Šakių raj.,Respublikonų partija,lietuvė ,13,"rusų, vokiečių",Ne ,Neturiu 
Karoliniškių,1952-05-06,vedęs,Ne ,",",JURGIS    JURKEVIČIUS,Bendorių k.,Aukštasis;Vilniaus universitetas;teisininkas;1979,"Kelionės, sportas",Trakai,Lietuvos socialdemokratų partija,lietuvis ,107,"anglų, lenkų, rusų",Ne ,Neturiu 
Karoliniškių,1971-07-16,nevedęs,Ne ,"UAB ""Audrola"",Direktorius",AUDRIUS    JASIONIS,Vilnius,Aukštasis;KTU;Vadybos ir verslo administravimas;2005,"Kelionės, žvejyba, šunys",Vilnius,Demokratinė darbo ir vienybės partija,lietuvis ,79,"rusų, anglų",Ne ,Neturiu 
Karoliniškių,1965-01-24,išsituokusi,Ne ,"Lietuvos Respublikos švietimo ir mokslo ministerija,Bendrojo ugdymo ir profesinio mokymo departamento Ikimokyklinio ir pradinio ugdymo skyriaus vyriausioji specialistė",ILONA    GRIGARAVIČIENĖ,Vilnius,"Aukštasis;Mykolo Romerio universitetas;Administravimo magistras;2006;Aukštasis;Vilniaus pedagoginis universitetas;Edukologijos magistras;2002;Sertifikatas;Lietuvos Valdorfo centras (prie PPRC), Vilnius;Valdorfo pedagogikos specialistė;2001;Aukštasis;VU, ŠPI;Matematikos mokytoja;1988","domiuosi politika, savivalda, darbo santykiais, teisine ir moksline literatūra. Laisvalaikiu - turizmas, iškylos gamtoje, pramoginiai renginiai, sportas",Šiauliai,Lietuvos Respublikos liberalų sąjūdis,lietuvė ,46,"rusų, anglų, lenkų",Ne ,Neturiu 
Karoliniškių,1971-08-26,vedęs,Ne ,"Nacionalinė Žemės Tarnyba prie Žemės Ūkio Ministerijos,Vilniaus rajono vedėjas",LAIMAS    DIENINIS,Vilnius,Aukštasis teisės mokslų magistras;LTU;Teisė ir valdymas;2003;Aukštasis universitetinis;VPU;pedagogas;1996,"Sportas, aktyvus poilsis gamtoje, kelionės – turizmas, literatūra, kultūros renginiai, kinas, muzika.",Vilnius,Politinė partija „Sąjunga Taip“,lietuvis ,18,"anglų, rusų, lenkų",Ne ,Neturiu 
Karoliniškių,1947-02-22,vedęs,Ne ,"VŠĮ Stasio Brundzos automobilių ir transporto muziejus,direktorius",STASYS    BRUNDZA,Vilnius,Aukštasis;Vilniaus inžinerinės statybos institutas (dabar VGTU);automobilių eksploatacija;1976,"automobiliai, muzika",Kaunas,„Drąsos kelias“ politinė partija, ,7,"rusų, vokiečių, anglų",Ne ,Neturiu 
Karoliniškių,1940-11-19,vedęs,Ne ,"Verslininkas,-",VYTAUTAS    BERNATONIS,Vilnius,Aukštasis;VISI;Inžinierius-mechanikas;1970,"Medžioklė, Pasaulio valstybių vystymosi raida",Prienų raj. Šilinių k.,Socialistinis liaudies Frontas,lietuvis ,3,rusų,Ne ,Neturiu 
Karoliniškių,1944-02-27,ištekėjusi,Ne ,"Lietuvos Respublikos Seimas,LR Seimo narė",DANUTĖ    BEKINTIENĖ,Vilnius,Aukštasis;Vilniaus valstybinio universiteto (dabar Vilniaus universiteto) Gamtos fakultetas;Biologijos ir chemijos dėstytojos specialybė;1967,"gėlių auginimas, grybavimas",Varėnos rajono Puvočių kaime Juozo Balčiaus ir Jecentos Balčienės trijų vaikų šeimoje,Tėvynės sąjunga - Lietuvos krikščionys demokratai,lietuvė ,47,,Ne ,Neturiu 
Karoliniškių,1961-05-01,vedęs,Ne ,VŠĮ Žaliosios politikos institutas,LINAS    BALSYS,Vilnius,Aukštasis universitetinis;Vilniaus Universitetas;Žurnalistika;1984,Radijo mėgėjas - trumpabangininkas,Vilnius,Išsikėlė pats,lietuvis ,,"anglų, rusų, prancūzų, vokiečių, lenkų",Ne ,Neturiu 
Karoliniškių,1950-09-06,ištekėjusi,Ne ,"Lietuvos muzikos ir teatro akademija,docentė",VIRGINIJA    APANAVIČIENĖ,Vilnius,Aukštasis universitetinis;LMTA;muzikologė;1975,sodininkystė,Trakų raj.,Lietuvos valstiečių ir žaliųjų sąjunga,lietuvė ,73,"anglų, rusų",Ne ,Neturiu 
Lazdynų,1965-07-06,vedęs,Ne ,"VGTU,Strateginių tyrimų skyriaus vedėjas",RYTIS    ZABIELSKAS,Vilnius,Aukštasis universitetinis;VU;Ekonomika;1990,,Vilnius,Respublikonų partija,lietuvis ,51,"rusų, anglų, lenkų",Ne ,Neturiu 
Lazdynų,1961-02-12,vedęs,Ne ,"UAB Monvilas,direktorius",SIGITAS    VAIŠNORAS,Vilnius,Aukštasis;VU;pramonės finansai;1985,"muzika,pažintinės kelionės,renginiai,žvejyba",Vilnius,Lietuvos žmonių partija,lietuvis ,18,rusų,Ne ,Neturiu 
Lazdynų,1951-03-04,išsiskyręs,Ne ,"Lietuvos Respublikos Seimas,Seimo narys",KAZIMIERAS    UOKA,Vilnius,Aukštasis universitetinis;VU;Istorija;1976,"sportas, tirizmas, techninė kūryba",Kaunas,Tautininkų sąjunga,lietuvis ,7,"vokiečių, rusų, lenkų",Ne ,Neturiu 
Lazdynų,1960-09-07,vedęs,Ne ,"UAB""Fabeta"",Vyriausiasis viešųjų ryšių specialistas",ALGIS    STRELČIŪNAS,Vilnius,Aukštasis;Vilniaus inžinerinis statybos institutas;Automobilių autoūkio specialybė (inžinierius mechanikas);1987,"Biliardas, kelionės, žvejyba",Vilnius,Tėvynės sąjunga - Lietuvos krikščionys demokratai,lietuvis ,88,rusų,Ne ,Neturiu 
Lazdynų,1967-07-23,vedęs,Ne ,"Lietuvos Respublikos švietimo ir mokslo ministerija,ministras",GINTARAS    STEPONAVIČIUS,Vilnius,Aukštasis teisės mokslų magistras;Vilniaus universitetas;teisininkas;1992,"muzika, knygos, filmai, krepšinis",Klaipėda,Lietuvos Respublikos liberalų sąjūdis,lietuvis ,3,"anglų, rusų",Ne ,Neturiu 
Lazdynų,1981-12-04,Nenurodė,Ne ,"UAB PASTA PASTA,Direktorė",OKSANA    ROKAŠEVIČ,Vilnius,Bakalauro laipsnis;Klaipėdos universitetas;Verslo administravimo vadybininkė;2011;Bakalauro laipsnis;Lietuvos kūno kultūros akademija;Lengvosios atletikos trenerė;2004,"sportas, menai, kūryba",Klaipėda,Lietuvos valstiečių ir žaliųjų sąjunga,lietuvė ,104,,Ne ,Neturiu 
Lazdynų,1960-10-27,vedęs,Ne ,"UAB Statybų takas,apdailos darbų meistras",OLEGAS    RATIUKAS,Vilnius,Aukštasis neuniversitetinis;Vilniaus Geležinkelių transporto technikumas;Kelių ūkio statyba ir ekploatavimas;1981,žvejyba,Vilniaus raj. Airėnų kaimas,Socialistinis liaudies Frontas,lietuvis ,17,"rusų, lenkų",Ne ,Neturiu 
Lazdynų,1963-05-11,ištekėjusi,Ne ,"BMA holdingas, redaktorė",ROMUALDA    POŠEVECKAJA,Vilnius,Aukštasis;Sankt Peterburgo psichologinio tren. institutas (Rusija);psichologija;1999;Aukštasis;Vilniaus pedagoginis universitetas;rusų kalba ir literatūra;1984,"skaitymas, turizmas, sportas",Vilnius,Lietuvos lenkų rinkimų akcija,lenkė ,10,"lenkų, rusų, anglų pagrindai",Ne ,Neturiu 
Lazdynų,1959-09-22,vedęs,Ne ,"Vilniaus m. savivaldybė,Mero pavaduotojas",JONAS    PINSKUS,Vilnius,Aukštasis;VU;Ekonomistas;1985,"Medžioklė, žvejyba, sportas","Kuršėnai, Šiaulių raj.",Darbo partija,lietuvis ,140,"rusų, anglų",Ne ,Neturiu 
Lazdynų,1964-09-16,išsiskyręs,Ne ,"VšĮ Zappart,direktorius",SAULIUS    PAUKŠTYS,Vilnius,Aukštasis;KTU;inžinierius-elektrotechnikas;1987,"dailė, muzika, grafika",Vilniaus m.,Politinė partija „Sąjunga Taip“,lietuvis ,77,"rusų, anglų",Ne ,Neturiu 
Lazdynų,1971-01-11,ištekėjusi,Ne ,",",ANŽELIKA    JANKOVSKAJA,Vilnius,Aukštasis universitetinis;Klaipėdos pedagoginis universiteta;Metodistas psicholos;1992,,Vilnius,Demokratinė darbo ir vienybės partija,lenkė ,78,"rusų, anglų, lenkų",Ne ,Neturiu 
Lazdynų,1971-10-06,išsituokusi,Ne ,"LR Seimo kanceliarija,Liberalų ir centro sąjungos frakcijos atstovė spaudai",JURGITA    GINTAUTAITĖ,Vilnius,Aukštasis;Vilniaus pedagoginis universitetas;Lietuvių filologija;1994,"gastronomija, literatūra, keramika",Vilnius,Liberalų ir centro sąjunga,lietuvė ,30,"rusų, anglų",Ne ,Neturiu 
Lazdynų,1952-06-21,Nenurodė,Ne ,",",ALGIRDAS    GENEVIČIUS,Vilnius,,,,Partija Tvarka ir teisingumas, ,62,rusų,Ne ,Neturiu 
Lazdynų,1951-12-20,vedęs,Ne ,"UAB ""Ūlos tėkmė"",Leidybos vyriausiasis redaktorius",VYTAUTAS    BUDNIKAS,Vilnius,Aukštasis;VU;žurnalistas;1984;Spec. vidurinis;Vilniaus prekybos technikumas;prekių žinovas;1975;Aštuonios klasės;Ukmergės proftechninė mokykla;tekintojas;1968,muzika ir šachmatai,Taujėnėlių k. Ukmergės raj.,„Drąsos kelias“ politinė partija,lietuvis ,15,"anglų, rusų, lenkų",Ne ,Neturiu 
Lazdynų,1953-05-31,partnerystė,Ne ,"Vilniaus miesto savivaldybė,mero pavaduotojas",ROMAS    ADOMAVIČIUS,Pasakiškių k.,Aukštasis;VGTU;inžinierius;1976,"kelionės, buriavimas, žvejyba, medžioklė",,Lietuvos socialdemokratų partija,lietuvis ,48,"anglų, prancūzų, vokiečių",Ne ,Neturiu 
Naujosios Vilnios,1952-01-07,vedęs,Ne ,"Vilniaus raj. ŽŪB ""Kyviškės"",Likvidacinės komisijos pirmininkas",SERGEJ    URSUL,Vilnius,Aukštasis;Lietuvos žemės ūkio akademija;Mokslinis agronomas;1977,"Muzika, kelionės","Lipecko k., Kotovskio raj., Odesos srt., Ukraina",Darbo partija, ,52,"lenkų, rusų, moldavų, ukrainiečių, vokiečių pagrindai",Ne ,Neturiu 
Naujosios Vilnios,1977-02-27,vedęs,Ne ,"UAB ""Alauša"",darbininkas",JUZEF    TOMAŠEVIČ-JAKOVIČ,Vilnius,Aukštasis;warsaw school of economics;ekonomistas;2001,sportas,didžioji pupojai,Lietuvos valstiečių ir žaliųjų sąjunga,lenkas ,42,"lenkų, anglų, vokiečių, rusų",Ne ,Neturiu 
Naujosios Vilnios,1971-04-15,išsiskyręs,Ne ,"SĮ ""Susisiekimo paslaugos"",padalinio vadovas",ŠARŪNAS    SKUČAS,Vilnius,Aukštasis;Vilniaus universitetas;Ekonomikos sisteminė analizė;1994,"Literatūra, kelionės, sportas, psichologija, menas",Vilniaus m.,Lietuvos Respublikos liberalų sąjūdis,lietuvis ,106,"rusų, anglų",Ne ,Neturiu 
Naujosios Vilnios,1954-04-15,išsituokusi,Ne ,"UAB „INTERNATIONAL TRADE HOLDING“,viešųjų ryšių ir marketingo vadovė",TATJANA    RINKEVIČIENĖ,Vilnius,Aukštasis;LENINGRADO KONSERVATORIJA;CHORO DIRIGENTĖ;1980,"muzika, teatras, kelionės, sportas","PRIMORĖS KRAŠTAS, RUSIJA",Lietuvos socialdemokratų partija,rusė ,44,rusų,Ne ,Neturiu 
Naujosios Vilnios,1966-01-20,vedęs,Ne ,"VRM pensininkas,",ROBERTAS    PRANCKŪNAS,Vilnius,Aukštasis;Naujasis Maskvos teisės institutas;teisininkas;2003;Aukštesnysis;Aukštesnioji J.Bartašiūno VRM mokykla;teisininkas;1989,kelionės dviračiu,Vilniaus m.,Lietuvos žmonių partija,lietuvis ,15,"rusų, lenkų",Ne ,Neturiu 
Naujosios Vilnios,1980-10-14,netekėjusi,Ne ,"UAB ""Bilan"",Specialistė",ILONA    POPLAVSKAJA,Vilnius,aukštasis universitetinis magistras;Mykolo Riomerio universitetas;Teisė ir valdymas;2008;aukštasis universitetinis bakalauras;Vilniaus pedagoginis universitetas;Edukologija ir mokytojo kvalifikacija;2005,"Parodų lankymas, kelionės, muzika, teatras, sportas",Vilnius,Respublikonų partija,lenkė ,36,"anglų, rusų, lenkų",Ne ,Neturiu 
Naujosios Vilnios,1971-05-20,vedęs,Ne ,"bedarbis,-",ALGIRDAS    PALECKIS,Vilnius,Aukštasis;VU;politologas;1994;Aukštasis;VU;žurnalistas;1994,"sportas, skaitymas, gamta","Bernas, Šveicarija",Socialistinis liaudies Frontas,lietuvis ,1,"rusų, vokiečių, anglų, prancūzų",Taip ,Neturiu 
Naujosios Vilnios,1964-02-25,vedęs,Ne ,"LR Vidaus reikalų ministerija,Ministras",ARTŪRAS    MELIANAS,Vilnius,Vilniaus m. savivaldybės taryba;1997 - 2000;Vilniaus m. savivaldybės taryba;2000 - 2000;LR Seimas;2000 - 2004;LR Seimas;2008 - 2012,"muzika, kelionės",Panevėžio m.,Liberalų ir centro sąjunga,lietuvis ,4,"rusų, anglų, lenkų",Ne ,Neturiu 
Naujosios Vilnios,1976-12-10,išsiskyręs,Ne ,"UAB ""BALTIC HOUSE"",Vadovas",VIAČESLAV    JANKELEVIČ,Nemėžio k.,Aukštasis;Vilniaus Gedimino technikos universitetas;Architektūros mokslai;2001,"pasaulio tautų istorija ir kultūra, architektūra, dizainas",Šalčininkai,Demokratinė darbo ir vienybės partija, ,46,"anglų, lenkų, rusų",Ne ,Neturiu 
Naujosios Vilnios,1948-03-05,vedęs,Ne ,"Europos parlamento nario J.Imbraso biuras,padėjėjas Lietuvoje",Bronius    CICĖNAS,Vilnius,Aukštasis;Kauno politechnikos institutas;šiluminė-energetika;1971,"Lauko tenisas, slidinėjimas, literatūra, sodininkystė","Ignalinos rajonas, Augutiškės  kaimas",Partija Tvarka ir teisingumas,lietuvis ,,"rusų, vokiečių, anglų",Ne ,Neturiu 
Naujosios Vilnios,1971-01-16,išsiskyręs,Ne ,"VŠĮ ""Ekspertai.eu"",direktorius",ROLANDAS    BORAVSKIS,Bareikiškių k.,,Aktorius ir režisierius privalo gyvenime domėtis viskuo. Pastaruoju metu domiuosi politika.,Vilniaus miestas,„Drąsos kelias“ politinė partija,lietuvis ,41,"rusų, lenkų",Taip ,Neturiu 
Naujosios Vilnios,1963-12-31,vedęs,Ne ,"VGTU (VISI) ir individualus verslas,vyresn.inžinierius, verslininkas",ALEKSANDRAS    BOJAROVAS,Vilnius,Aukštasis universitetinis;VISI (VGTU);Statybos inžinerija;1989,"automobiliai, sportas, aktyvus poilsis gamtoje ( žūklė ), menas, klasikinė muzika","Vilnius, Vilniaus m.sav.",Politinė partija „Sąjunga Taip“,rusas ,49,"rusų, lenkų, vokiečių",Ne ,Neturiu 
