apygarda,gimimo_data,seimynine_padetis,sunkus_nusikaltimas,darboviete,kandidatas,gyvena,issilavinimas,pomegiai,gimimo_vieta,iskele,tautybe,saraso_numeris,uzsienio_kalbos,pripazintas_kaltu,neatlikta_bausme
Plungės - Rietavo,1938 02 07,Vedęs,Nebuvo,"Lietuvos karo akademija, Vadybos katedra, docentas",Liudvikas Saulius RAZMA,"Platelių mst. , Plungės raj.","1960 - VU, ekonomistas",Gamta,,Krikščionių demokratų sąjunga,,,Rusų,Nėra,Neturi
Plungės - Rietavo,1947 01 07,Vedęs,Nebuvo,"Klaipėdos valstybinio jūrų uosto direkcija, vidaus auditorius",Vytautas POCIUS,"Plungė , Plungės raj.","1971 - Vilniaus valstybinis V.Kapsuko universitetas, ekonomistas",Futbolas,,Naujoji sąjunga (socialliberalai),,,Anglų,Nėra,Neturi
Plungės - Rietavo,1958 10 04,Vedęs,Nebuvo,"Plungės PSPC, vyriausiasis gydytojas",Visvaldas NEKRAŠAS,"Plungė , Plungės raj.","1984 - Vilniaus universitetas, Medicinos fakultetas, gydytojas psichiatras",,,Lietuvos socialdemokratų partija,,,Vokiečių,Nėra,Neturi
Plungės - Rietavo,1959 08 07,Vedęs,Nebuvo,,Gintaras MORKIS,"Plungė , Plungės raj.",,,,Lietuvos centro sąjunga,,,,Nėra,Neturi
Plungės - Rietavo,1963 04 18,Vedęs,Nebuvo,"Rietavo savivaldybė, mero pavaduotojas",Jonas KUZMINSKAS,"Labardžių k. , Rietavo sav.","1987 - LŽŪA, Inžinierius-mechanikas;1982 - Rietavo TŪT, Technikas-mechanikas",Sportas,,Lietuvos valstiečių partija,,,Prancūzų,Nėra,Neturi
Plungės - Rietavo,1964 05 15,Vedęs,Nebuvo,"A. Klišonio komercinė firma ""Inesa"", savininkas",Audrius KLIŠONIS,"Alsėdžių mst. , Plungės raj.","1987 - Kauno medicinos institutas, Provizorius",Kalnų slidinėjimas,,Lietuvos liberalų sąjunga,,,Vokiečių,Nėra,Neturi
Plungės - Rietavo,1950 01 27,Vedęs,Nebuvo,"Plungės žemės ūkio mokykla, direktorius",Vitas KLIMAS,"Plungė , Plungės raj.","1971 - Vilniaus valstybinis pedagoginis institutas, fizikos mokytojas",Krepšinio sporto vystymas,,Nuosaikiųjų konservatorių sąjunga,,,Vokiečių,Nėra,Neturi
Kretingos,1946 10 07,Vedęs,Nebuvo,"Kretingos aukštesnioji žemės ūkio mokykla, direktoriaus pavaduotojas ugdymui",Alfonsas Algimantas ZALIAPUGAS,"Padvarių k. , Kretingos raj.","1985 - Maskvos Timiriazevo v. žemės ūkio akademijos Pedagoginis fakultetas, Ekonominių dalykų dėstytojas;1971 - Lietuvos žemės ūkio akademija, Mokslinis agronomas",Sportas,,Lietuvos valstiečių partija,,,Anglų,Nėra,Neturi
Kretingos,1939 08 02,,Nebuvo,bedarbis,Vladislavas VIRŠILA,Panevėžys ,"Tautų universitetas, Esperanto;Vilniaus universitetas, Teisė",Esperanto kalba,,"Lietuvos partija ""Socialdemokratija 2000""",,,Rusų,Nėra,Neturi
Kretingos,1950 05 28,Vedęs,Nebuvo,"Kretingos miškų urėdija, eigulys",Povilas TURAUSKIS,"Šukės k. , Kretingos raj.","1976 - Lietuvos žemės ūkio akademija, Agronomas",Medžioklė,,Išsikėlė pats,,,Rusų,Nėra,Neturi
Kretingos,1936 08 09,Vedęs,Nebuvo,"Pensininkas, iki 1996 m. rugpjūčio dirbęs Kretingos raj. centrinėje ligoninėje, nuo 1996 m. - LRS narys, SRK pirmininko pavaduotojas",Antanas ŠVITRA,"Dainaviškių k. , Lazdijų raj.","1960 - Vilniaus universitetas, Gydytojas",Sodininkas mėgėjas,,Lietuvos politinių kalinių ir tremtinių sąjunga,,,Rusų,Nėra,Neturi
Kretingos,1946 06 01,Vedęs,Nebuvo,"Kretinga UAB ""Sija"", generalinis direktorius",Alfonsas ŠIMKUS,"Kvecių k. , Kretingos raj.","1980 - Vilniaus inžinerinis statybos institutas, inžinerius ekonomistas",Medžioklė,,Lietuvos centro sąjunga,,,Anglų,Nėra,Neturi
Kretingos,1946 03 19,Vedęs,Nebuvo,"Kretingos Pranciškonų gimnazija, pavaduotojas ugdymui",Juozas ŠAKINIS,"Kretinga , Kretingos raj.","1977 - Valstybinis dailės institutas, mokytojas",,,Lietuvos krikščionių demokratų partija,,,Rusų,Nėra,Neturi
Kretingos,1957 03 12,,Nebuvo,"Kretingos sporto mokykla, lengvosios atletikos treneris",Juozas PELIONIS,"Rubulių k. , Kretingos raj.","1991 - Lietuvos kūno kultūros institutas, kūno kultūros dėstytojas",Gamta,,Moderniųjų krikščionių demokratų sąjunga,,,Rusų,Nėra,Neturi
Kretingos,1963 04 17,,Nebuvo,Laikinai nedirba,Darius NORKUS,"Ryliškių k. , Alytaus raj.","Gomelio kooperacijos institutas Vilniaus filialas, Ekonomika",Muzika,,Respublikonų partija,,,Lietuvių,Nėra,Neturi
Kretingos,1945 09 20,Išsiskyrusi,Nebuvo,"Vakarų Lituvos televizija, direktorė",Janė NARVILIENĖ,"Padvarių k. , Kretingos raj.","1975 - Vilniaus valstybinis pedagoginis institutas, rusų kalbos ir literatūros mokytoja",,,Naujosios demokratijos partija,,,Vokiečių,Nėra,Neturi
Kretingos,1950 07 28,Netekėjusi,Nebuvo,"Kretingos PSPC, apylinkės terapeutė",Irena NARMONTAITĖ,"Kretinga , Kretingos raj.","1975 - Vilniaus valstybinis universitetas, Medicinos fak., gydytoja terapeutė",Kelionės,,Krikščionių demokratų sąjunga,,,Prancūzų,Nėra,Neturi
Kretingos,1952 09 02,Vedęs,Nebuvo,"Lietuvos teisės akademija, docentas",Egidijus KLUMBYS,Vilnius ,"1996 - Vilniaus universitetas, teisininkas;1981 - TSRS Medicinos mokslų akademijos N.Burdenkos vardo neurochirurgijos mokslinio tyrimo institutas;1976 - Kauno medicinos institutas, gydytojas;1970 - Kauno J.Aleksonio vidurinė mokykla",Knygos,,Naujoji sąjunga (socialliberalai),,,Anglų,Nėra,Neturi
Kretingos,1974 04 29,,Nebuvo,"UAB ""Verslo valdymo ekspertai"", konsultantė",Vilija JONUŠAITYTĖ,Klaipėda ,"1998 - Klaipėdos universitetas, Politologija",Klasikinė muzika,,Išsikėlė pati,,,Prancūzų,Nėra,Neturi
Kretingos,1943 10 10,Vedęs,Nebuvo,"UAB ""Edija"", direktorius",Edmundas Juozapas JASINSKAS,"Kretinga , Kretingos raj.","1977 - LŽŪ akademija, neakivaizdinio skyriaus Agronomijos fakultetas, mokslinis agronomas;1965 - Kretingos žemės ūkio technikumas, agronomas",Europos ir Lietuvos istorija,,Nuosaikiųjų konservatorių sąjunga,,,Rusų,Nėra,Neturi
Kretingos,1948 10 06,,Nebuvo,Laikinai nedirbu,Vytautas EIDUKAITIS,Vilnius ,"1978 - Gagarino v. karo akademija, Strateginės aviacijos esk. vadas;1972 - Tambovo aukštoji karo lakūnų m-la, Lakūnas-inžinierius",Skraidymas,,Lietuvių tautininkų sąjunga,,,Rusų,Nėra,Neturi
Skuodo  - Mažeikių,1922 05 22,Vedęs,Nebuvo,"Vilniaus universiteto Medicinos fakultetas, Lietuvos angio chirurgijos centro profesorius",Augustas PRONCKUS,"Gedrimų k. , Skuodo raj.","1950 - Vilniaus universitetas, medicina",Sportas,,Krikščionių demokratų sąjunga,,,Anglų,Nėra,Neturi
Skuodo  - Mažeikių,1951 04 18,Ištekėjusi,Nebuvo,"Lietuvos švietimo ir mokslo ministerija, viceministrė",Gražina PALIOKIENĖ,Vilnius ,"1975 - Tartu valstybinis universitetas, Medicinos fakultetas, gydytoja;1969 - Kaišiadorių vid. mokykla",Karitatyvinė veikla,,Lietuvos krikščionių demokratų partija,,,Anglų,Nėra,Neturi
Skuodo  - Mažeikių,1956 06 25,Vedęs,Nebuvo,"SP UAB ""Mažeikių autobusų parkas"", direktoriaus pavaduotojas",Pranas NOREIKA,"Mažeikiai , Mažeikių raj.","1995 - Lietuvos žemės ūkio akademija, ekonomistas-organizatorius;1975 - Vilniaus geležinkelių transporto technikumas, technikas-elektrikas",Medžioklė,,Lietuvos socialdemokratų partija,,,Rusų,Nėra,Neturi
Skuodo  - Mažeikių,1938 02 10,Vedęs,Nebuvo,"Telšių apskrities viršininko administracija, apskrities viršininko patarėjas",Antanas Algimantas LAURAITIS,"Ryškėnų k. , Telšių raj.","1960 - Vilniaus pedagoginis indtitutas, Žmogaus anatomija;1955 - Sedos vidurinė mokykla",,,Nuosaikiųjų konservatorių sąjunga,,,Rusų,Nėra,Neturi
Skuodo  - Mažeikių,1942 04 26,Vedęs,Nebuvo,"Gėsalų ŽŪB, pirmininkas",Edvardas KAREČKA,"Gėsalų k. , Skuodo raj.","1972 - Lietuvos veterinarijos akademija, Zootechnikas;1963 - Klaipėdos žemės ūkio technikumas, Veterinarijos technikas",Kelionės,,Lietuvos valstiečių partija,,,,Nėra,Neturi
Skuodo  - Mažeikių,1953 06 30,Vedęs,Nebuvo,"UAB ""Žemalės agraras"", UAB ""Aušra"", ūkininkas, direktorius",Aleksas BUTKUS,"Žemalės k. , Mažeikių raj.","1984 - Lietuvos žemės ūkio universitetas, mokslinis agronomas",Medžioklė,,Naujoji sąjunga (socialliberalai),,,Rusų,Nėra,Neturi
Skuodo  - Mažeikių,1946 11 04,Vedęs,Nebuvo,"Lietuvos nacionalinis radijas ir televizija, žurnalistas",Bronislavas BUŠMA,Vilnius ,"1970 - Muzikos akademija, Dramos teatro direktorius",Medžioklė,,Lietuvos liberalų sąjunga,,,Rusų,Nėra,Neturi
Skuodo  - Mažeikių,1955 08 10,,Nebuvo,"UAB ''Burba ir Ko'' tarptautinis išradimų diegimas, ekaperimentinės gamyklos prezidentas",Justinas BURBA,Klaipėda ,"1992 - Irkutsko politechnikos institutas, inžinierius mechanikas",Filmavimas,,Išsikėlė pats,,,Rusų,Nėra,Neturi
Skuodo  - Mažeikių,1965 06 27,,Nebuvo,"VŠĮ ''Skuodo ligononė'', vyriausioji gydytoja",Ramutė BERENIENĖ,"Skuodas , Skuodo raj.","1989 - Kauno medicinos instituas, gydytoja",Gėlių auginimas,,Išsikėlė pati,,,Vokiečių,Nėra,Neturi
Mažeikių,1965 05 25,Vedęs,Nebuvo,"Vytauto Pialgausko individuali įmonė, savininkas",Vytautas PRIALGAUSKAS,"Mažeikiai , Mažeikių raj.",1983 - Tikšlių vidurinė m-kla,,,Išsikėlė pats,,,Rusų,Nėra,Neturi
Mažeikių,1942 08 29,Vedęs,Nebuvo,"Mažeikių rajono žemės ūkio skyrius, ž.ū. technikos valstybinės priežiūros inžinierius inspektorius",Leonas MITKUS,"Mažeikiai , Mažeikių raj.","1973 - Lietuvos žemės ūkio akademijos Mechanizacijos fakultetas, Inžinierius-mechanikas",Literatūra,,Lietuvos valstiečių partija,,,Vokiečių,Nėra,Neturi
Mažeikių,1956 04 15,Vedęs,Nebuvo,"LR Seimas, Seimo narys",Sigitas KAKTYS,"Puokės k. , Skuodo raj.","1980 - Kauno medicinos institutas, gydytojas",Fotografavimas,,Išsikėlė pats,,,Rusų,Nėra,Neturi
Mažeikių,1954 02 24,Vedęs,Nebuvo,"SP UAB ""Mažeikių šilumos tinklai"", generalinis direktorius",Jonas JURKUS,"Mažeikiai , Mažeikių raj.","1989 - Kaupo politechnikos institutas, inžinierius-mechanikas",Sodas,,Lietuvos socialdemokratų partija,,,Anglų,Nėra,Neturi
Mažeikių,1970 06 02,Vedęs,Nebuvo,"Politikos savaitraštis ""Atgimimas"", vyriausiasis redaktorius",Eduardas EIGIRDAS,Vilnius ,"1998 - VU Tarptautinio verslo mokykla, ekonomistas;1996 - VU Žurnalistikos institutas, žurnalistas",,,Lietuvos centro sąjunga,,,Anglų,Nėra,Neturi
Mažeikių,1955 06 25,Vedęs,Nebuvo,"VĮ Mažeikių ligoninė, vyr. gydytojas",Vilhelmas DŽIUGELIS,"Mažeikiai , Mažeikių raj.","1979 - VDU Medicinos fakultetas, gydytojas pediatras",Joga,,Nuosaikiųjų konservatorių sąjunga,,,Rusų,Nėra,Neturi
Mažeikių,1960 03 19,Vedęs,Nebuvo,"UAB ""Mėlynieji stogai"", direktorius",Viktoras BUGNEVIČIUS,"Mažeikiai , Mažeikių raj.","1984 - Tarptautinis Jaunimo institutas, istorijos mokytojas",Bendravimas su žmonėmis,,Naujoji sąjunga (socialliberalai),,,Anglų,Nėra,Neturi
Daugiamandatė,1960 05 24,Vedęs,Nebuvo,"LR Seimas, Seimo narys",Arvydas AKSTINAVIČIUS,Vilnius ,"1986 - Vilniaus universitetas, gydomoji medicina, gydytojas",Daržininkystė,,Išsikėlė pats,,,Anglų,Nėra,Neturi
Marių,1963 11 24,,Nebuvo,"VĮ Klaipėdos ligoninė, personalo sk. vyresnioji inspektorė",Lolita ŽILIUVIENĖ,Klaipėda ,"1986 - Lietuvos veterinarijos akademija, zooinžinerija",Biologija,,Moderniųjų krikščionių demokratų sąjunga,,,Rusų,Nėra,Neturi
Baltijos,1970 09 02,,Nebuvo,"Vyriausybės atstovo Klaipėdos apskrityje intitucija, juristas - Vyriausybės atstovo patarėjas",Artūras ŽIČKUS,Palanga ,,,,Išsikėlė pats,,,Rusų,Nėra,Neturi
Danės,1960 03 15,Vedęs,Nebuvo,"LKAB ""Klaipėdos Smeltė"", gamybos ir komercijos direktorius",Rimvydas VAŠTAKAS,Klaipėda ,"1983 - Vilniaus inžinerinis statybos institutas, Inžinierius mechankas",,,Lietuvos liberalų sąjunga,,,Anglų,Nėra,Neturi
Panemunės,1949 04 15,Ištekėjusi,Nebuvo,,Tatjana VILČINSKIENĖ,Kaunas ,"1981 - Vilniaus konservatorija, dainininkė",Filosofija,,Naujoji sąjunga (socialliberalai),,,Vokiečių,Nėra,Neturi
Pramonės,1932 01 01,Vedęs,Nebuvo,"Kauno miesto savivaldybė, miesto tvarkymo vyriausiasis inžinierius",Alfonsas ŠULCAS,Kaunas ,"1960 - Kauno politechnikos institutas, Pramoninė ir civilinė statyba",Medžioklė,,Lietuvių tautininkų sąjunga,,,Rusų,Nėra,Neturi
Dainavos,1968 09 03,Nevedęs,Nebuvo,"Kauno teritorinė ligonių kasa, juristas",Valdas ZUBINAS,Kaunas ,"2000 - Vytauto Didžiojo universitetas, teisininkas",Filosofija,,Naujoji sąjunga (socialliberalai),,,Rusų,Nėra,Neturi
Kalniečių,1947 04 01,Vedęs,Nebuvo,"UAB ""Okseta"", verslo administratorius",Antanas TATARIŪNAS,Kaunas ,"1970 - Kauno medicinos institutas, Biofizika",Mokslas,,Nuosaikiųjų konservatorių sąjunga,,,Anglų,Nėra,Neturi
Žaliakalnio,1951 07 19,Vedęs,Nebuvo,"Vilniaus m. savivaldybės Miesto plėtros departamentas, direktoriaus pavaduotojas",Henrikas ŽUKAUSKAS,Vilnius ,"1975 - VISI, Architektūra",,,Lietuvos liberalų sąjunga,,,Anglų,Nėra,Neturi
Centro,1960 06 09,,Nebuvo,,Vidmantas STANIULIS,"Avižienių k. , Vilniaus raj.",,,,Lietuvos centro sąjunga,,,,Nėra,Neturi
Aleksoto -  Vilijampolės,1945 05 15,Vedęs,Nebuvo,"Kauno miesto savivakldybė, Tarybos narys",Gediminas ŽEMAITIS,Kaunas ,"1981 - Lietuvos ŽŪU, inžinierius mechanikas;1971 - Kauno teisės akademija, teisininkas",Fotografavimas,,Išsikėlė pats,,,Rusų,Nėra,Neturi
Šilainių,1945 03 19,Vedęs,Nebuvo,"Kauno m. savivaldybė, meras",Vytautas ŠUSTAUSKAS,Kaunas ,"1964 - Klaipėdos laivų statybos technikumas, technikas-technologas",Automobiliai,,Lietuvos laisvės sąjunga,,,Rusų,Nėra,Neturi
Naujosios Vilnios,1971 04 19,Nevedęs,Nebuvo,"Vilniaus darbo birža, kompiuterinių duomenų bazių administratorius",Miroslav ZACHAREVIČ,Vilnius ,"1993 - Vilniaus universitetas, taikomoji matematika",Dirbti,,"Lietuvos partija ""Socialdemokratija 2000""",,,Anglų,Nėra,Neturi
Lazdynų,1955 01 01,,Nebuvo,"UAB ""Arvitra"" pardavimo vadybininkas",Viktoras ŠIMELEVIČIUS,Vilnius ,"1979 - Vilniaus valstybinis universitetas, fizikas",Kelionės,,Moderniųjų krikščionių demokratų sąjunga,,,Lenkų,Nėra,Neturi
Karoliniškių,1968 08 08,Nevedęs,Nebuvo,"Lietuvos Respublikos Seimas, Seimo narys",Rolandas ZUOZA,Vilnius ,"1993 - Vilniaus pedagoginis universitetas, istorijos mokytojas;1986 - Vilniaus 18-oji vidurinė mokykla",,,Naujoji sąjunga (socialliberalai),,,Anglų,Nėra,Neturi
Justiniškių,1925 01 04,Vedęs,Nebuvo,pensininkas,Zigmas ZINKEVIČIUS,Vilnius ,"1950 - Vilniaus universitetas, lietuvių k. ir lit.",Slidinėjimas,,Lietuvos krikščionių demokratų partija,,,Lenkų,Nėra,Neturi
Šeškinės,1957 10 19,Išsiskyręs,Nebuvo,"UAB ""Vilniaus pirmosios ATĮ"" prekyba, naujų projektų vadovas",Eduardas ŠABLINSKAS,Vilnius ,"1987 - Vilniaus valstybinis universitetas, Istorijos fakultetas, istorikas, istorijos dėstytojas",Futbolas,,Naujoji sąjunga (socialliberalai),,,Rusų,Nėra,Neturi
Fabijoniškių,1975 07 22,Nevedęs,Nebuvo,"Lietuvos teisės akademija, doktorantas",Ignas VĖGĖLĖ,Vilnius ,"1998 - VU, teisininkas",,,Krikščionių demokratų sąjunga,,,Rusų,Nėra,Neturi
Fabijoniškių,1966 10 27,Vedęs,Nebuvo,"LR Vyriausybės kanceliarija, Teisės ir teisėtvarkos departamento patarėjas civilinės teisės klausimais",Raimondas ŠUKYS,Šiauliai ,"1992 - Vilniaus universiteto Teisės fakultetas, Teisininkas",Darbas sode,,Lietuvos liberalų sąjunga,,,Anglų,Nėra,Neturi
Fabijoniškių,1958 02 10,Vedęs,Nebuvo,"Nuosaikiųjų konservatorių rinkimų štabas, vadovas",Stasys ŠEDBARAS,Vilnius ,"1981 - VVU Teisės fakultetas, teisininkas",Muzika,,Nuosaikiųjų konservatorių sąjunga,,,Rusų,Nėra,Neturi
Fabijoniškių,1954 08 03,Vedęs,Nebuvo,"Biochemijos institutas, direktoriaus pavaduotojas",Petras MONTRIMAS,Vilnius ,"1982 - Vilniaus inžinerinis statybos institutas, Inž.-elektrikas",Dailė,,Lietuvos nacionaldemokratų partija,,,Vokiečių,Nėra,Neturi
Fabijoniškių,1948 01 27,Vedęs,Nebuvo,"Vilniaus Gedimino technikos universitetas, Humanitarinių ir socialinių mokslų katedros docentas",Algirdas KUNČINAS,Vilnius ,"1978 - Vilniaus Universitetas, Filosofija;1970 - Vilniaus inžinerinis statybos institutas, Inžinierius-radistas;1965 - Alytaus II-oji vidurinė mokykla",Faleristika,,Lietuvos demokratinė darbo partija,,,Vokiečių,Nėra,Neturi
Fabijoniškių,1953 01 05,Vedęs,Nebuvo,"P.Lukaševičiaus TŪB ""Agrogama"", direktorius",Arvydas KILIKEVIČIUS,Vilnius ,"1983 - VISI, inžinierius",Automobilių sportas,,"Lietuvos partija ""Socialdemokratija 2000""",,,Rusų,Nėra,Neturi
Fabijoniškių,1945 08 10,Vedęs,Nebuvo,"UAB ''Vilnelė'', direktorius",Kazimieras KAVALIAUSKAS,"Kėbliškių k. , Prienų raj.","1975 - Kauno politechnikos institutas, inžinierius elektronikas",Folkloras,,"Lietuvos liaudies sąjunga ""Už teisingą Lietuvą""",,,Rusų,Nėra,Neturi
Fabijoniškių,1932 01 01,Vedęs,Nebuvo,"Vilniaus pedagoginis universitetas, Sporto metodikos katedros vedėjas",Povilas Petras KAROBLIS,Vilnius ,"1955 - Lietuvos kūno kultūros institutas, kūno kultūros dėstytojas",Sportas,,Naujoji sąjunga (socialliberalai),,,Anglų,Nėra,Neturi
Fabijoniškių,1955 08 01,,Nebuvo,"Lietuvos Respublikos Seimas, Seimo nario E.Zingerio padėjėja",Vilija GRINCEVIČIENĖ,Vilnius ,"1979 - Vilniaus pedagoginis institutas, biologija",Fantastinė literatūra,,"""Jaunosios Lietuvos"", naujųjų tautininkų ir politinių kalinių sąjunga",,,Anglų,Nėra,Neturi
Fabijoniškių,1948 07 25,Vedęs,Nebuvo,"UAB ""Hago"", energetikas",Tadeuš FILIPOVIČ,Vilnius ,"1973 - Sankt Peterburgo geležinkelio transporto institutas, inžinierius elektromechanikas",Psichologija,,Lietuvos lenkų rinkimų akcija,,,Lenkų,Nėra,Neturi
Fabijoniškių,1962 01 27,Vedęs,Nebuvo,"Lietuvos Respublikos Seimas, Seimo narys",Algis ČAPLIKAS,Vilnius ,"1985 - Vilniaus inžinerinis statybos institutas, inžinierius-geodezininkas",,,Lietuvos centro sąjunga,,,Rusų,Nėra,Neturi
Fabijoniškių,1958 01 17,Vedęs,Nebuvo,"LR Seimas, Seimo narys, Užsienio reikalų komiteto pirmininkas",Audronius AŽUBALIS,Vilnius ,"1988 - Vilniaus universitetas, žurnalistas",,,Tėvynės sąjunga  (Lietuvos konservatoriai),,,Lenkų,Nėra,Neturi
Šeškinės,1954 03 05,Vedęs,Nebuvo,"Lietuvos Respublikos Seimas, Socialinių reikalų ir darbo komiteto pirmininko pavaduotojas",Algirdas SYSAS,Vilnius ,"1983 - Vilniaus universitetas, ekonomika;1973 - Vilniaus politechikumas, radijo elektronikas",,,Lietuvos socialdemokratų partija,,,Anglų,Nėra,Neturi
Šeškinės,1959 12 15,,Nebuvo,"Puslaidininkių fizikos institutas, mokslinis bendradarbis",Paulius SAKALAS,Vilnius ,"1983 - Vilniaus universitetas, fizikas",Muzika,,"Lietuvos partija ""Socialdemokratija 2000""",,,Anglų,Nėra,Neturi
Šeškinės,1965 01 02,Vedęs,Nebuvo,"Vilniaus m. universitetinė ligoninė, gydytojas chirurgas skubiai pagalbai teikti.",Eduardas PABARČIUS,Vilnius ,"1990 - Tartu universitetas, gydytojas",Literatūra,,Krikščionių demokratų sąjunga,,,Rusų,Nėra,Neturi
Šeškinės,1967 08 31,Išsiskyrusi,Nebuvo,"UAB ""Profsąjungų mokymo ir tyrimo institutas"", ekonomistė",Jovita MEŠKAUSKIENĖ,"Salininkai , Vilnius","1990 - Vilniaus universitetas, statistika",Turizmas,,Nuosaikiųjų konservatorių sąjunga,,,Vokiečių,Nėra,Neturi
Šeškinės,1963 11 30,Vedęs,Nebuvo,"LR Seimas, Seimo narys",Alvydas MEDALINSKAS,Vilnius ,"1992 - Londono universitetas, Tarptaut. santykiai (politologas);1985 - VU Pramonės ekonomikos fakultetas, Ekonomistas",Kelionės,,Lietuvos liberalų sąjunga,,,Anglų,Nėra,Neturi
Šeškinės,1957 03 23,Vedęs,Nebuvo,"Lietuvos Respublikos Vyriausybė, valstybės konsultantas - Ministro Pirmininko patarėjas",Kęstutis MASIULIS,Vilnius ,"1980 - Vilniaus universitetas Fizikos fakultetas, fizikos dėstytojas;1975 - Kelmės vid. mokykla",Filosofija,,Tėvynės sąjunga  (Lietuvos konservatoriai),,,Rusų,Nėra,Neturi
Šeškinės,1955 03 16,Vedęs,Nebuvo,"Sveikatos apsaugos ministerija, viceministras",Vytautas KRIAUZA,Vilnius ,"1979 - Kauno medicinos institutas, gydytojas neurochirurgas",,,Lietuvos krikščionių demokratų partija,,,Anglų,Nėra,Neturi
Šeškinės,1942 01 16,Vedęs,Nebuvo,"Vilniaus universitetas, Istorijos fakultetas, Naujosios istorijos katedros docentas",Algis Povilas KASPERAVIČIUS,Vilnius ,"1975 - Vilniaus valstybinis universitetas, Istorikas",Ėjimo sportas,,Lietuvos nacionaldemokratų partija,,,Prancūzų,Nėra,Neturi
Šeškinės,1956 11 14,,Nebuvo,"Vilniaus Vingio vidurinė mokykla, dir. pavaduotoja",Liubovė GLUŠAKOVA,Vilnius ,"1988 - Vilniaus valstybinis universitetas, Teisininkė;1978 - Rusija, Armavico pedagoginis universitetas, Mokytoja",Kelionės,,Lietuvos socialistų partija,,,Rusų,Nėra,Neturi
Šeškinės,1933 02 14,,Nebuvo,"Žemės ūkio ministerija, Žuvininkystės departamentas, Jūrų žvejybos skyriaus viršininkas - direktoriaus pavaduotojas",Algirdas Aleksandras GEDRIMAS,Vilnius ,"1962 - Kaliningrado žuvų pramonės ir ūkio techninis institutas, Žuvų produktų technologija",Gamta,,Moderniųjų krikščionių demokratų sąjunga,,,Anglų,Nėra,Neturi
Šeškinės,1944 11 20,Vedęs,Nebuvo,"SPAB ""Lietuvos geležinkeliai"", skyriaus viršininkas",Raimundas GAIŽAUSKAS,Vilnius ,"1970 - Rygos civilinis aviacijos institutas, lėktuvų eksploatacija",Sportuoti,,Lietuvos centro sąjunga,,,Anglų,Nėra,Neturi
Šeškinės,1940 01 04,Vedęs,Nebuvo,"Vilniaus m. Vl.Sirokomlės vid. mokykla, direktorius",Jan Tadeuš DOVGIALO,Vilnius ,"1975 - Gardino pedagoginis universitetas, matematikas",,,Lietuvos lenkų rinkimų akcija,,,Rusų,Nėra,Neturi
Justiniškių,1950 10 11,Vedęs,Nebuvo,"Vilniaus raj. savivaldybė, kultūros, sporto ir turizmo sk. vedėjas",Edmund ŠOT,Vilnius ,"Lietuvos valst. KKI, fizinio lavinimo dėstytojas",Knygos,,Lietuvos lenkų rinkimų akcija,,,Rusų,Nėra,Neturi
Justiniškių,1965 11 26,Išsiskyręs,Nebuvo,"AB ""Centro kubas"", direktorius",Arūnas STROLIS,Vilnius ,"VVPI, geografija-fizinis lavinimas",Kalnų slidinėjimas,,Nuosaikiųjų konservatorių sąjunga,,,Anglų,Nėra,Neturi
Justiniškių,1953 01 01,Vedęs,Nebuvo,"Vilniaus universiteto Medicinos fakultetas, bendrosios terapijos ir reumatologijos klinikos docentas",Juozas RAISTENSKIS,Vilnius ,"1976 - Kauno medicinos institutas, Gydytojas",Sportas,,Lietuvos liberalų sąjunga,,,Vokiečių,Nėra,Neturi
Justiniškių,1955 04 13,Ištekėjusi,Nebuvo,"LR Seimas, LR Seimo nario padėjėja sekretorė",Rima MATIJOŠIENĖ,"Švenčionys , Švenčionių raj.","1978 - Vilniaus universitetas, fizikė",Gėlininkystė,,"Lietuvos partija ""Socialdemokratija 2000""",,,Anglų,Nėra,Neturi
Justiniškių,1957 10 22,Vedęs,Nebuvo,"UAB ""La-Nika Baltic-LTD"", deklarantas-vadybininkas",Kęstutis GECEVIČIUS,Vilnius ,"1984 - Vilniaus valstybinis universitetas, istorikas",Kandidatas į sporto meistrus (šaškės),,Naujoji sąjunga (socialliberalai),,,Anglų,Nėra,Neturi
Justiniškių,1954 05 17,Išsiskyrusi,Nebuvo,"Lietuvos Respublikos Seimas, Seimo narė",Sigita BURBIENĖ,Vilnius ,"1977 - Vilniaus universitetas, statistika",Skaitymas,,Lietuvos demokratinė darbo partija,,,Rusų,Nėra,Neturi
Justiniškių,1955 05 29,Vedęs,Nebuvo,,Egidijus BIČKAUSKAS,"Jieznas , Prienų raj.",,,,Lietuvos centro sąjunga,,,Rusų,Nėra,Neturi
Karoliniškių,1949 03 19,,Nebuvo,"Vilniaus advokatų kontora, advokatas",Antanas VIRBALAS,Vilnius ,"1977 - Vilniaus valstybinis V. Kapsuko vardo universitetas, teisininkas",,,Lietuvos laisvės lyga,,,Rusų,Nėra,Neturi
Karoliniškių,1957 10 01,Vedęs,Nebuvo,"Mokslo ir studijų departamentas prie Švietimo ir mokslo ministerijos, studijų skyriaus vedėjas",Rimantas VAITKUS,Vilnius ,"1980 - Vilniaus universitetas, chemija",Kelionės,,Lietuvos socialdemokratų partija,,,Anglų,Nėra,Neturi
Karoliniškių,1941 10 10,Vedęs,Nebuvo,,Vikentij SUCHOVEJ,Vilnius ,"1971 - Vilniaus inženerinis statybos institutas, inžnierius-mechanikas",,,Lietuvos lenkų rinkimų akcija,,,Rusų,Nėra,Neturi
Karoliniškių,1958 03 14,Vedęs,Nebuvo,"LR Seimas, Seimo kancleris",Jurgis RAZMA,"Žvirblaičių k. , Plungės raj.","1981 - Vilniaus universitetas, fizika",Poilsis gamtoje,,Tėvynės sąjunga  (Lietuvos konservatoriai),,,Anglų,Nėra,Neturi
Karoliniškių,1956 02 25,,Nebuvo,"UAB ""Inturos transportas"", direktorius",Vladimir POLENOV,Vilnius ,,,,"Lietuvos partija ""Socialdemokratija 2000""",,,Lenkų,Nėra,Neturi
Karoliniškių,1961 03 01,Vedęs,Nebuvo,"LR Seimo kanceliarija, LR Seimo nario padėjėjas-sekretorius",Albinas PILIPAUSKAS,Vilnius ,"1984 - Vilniaus universitetas, germanistas;1979 - Pabradės 2-ji vid. m-kla",Laisvalaikis su šeima,,Nuosaikiųjų konservatorių sąjunga,,,Vokiečių,Nėra,Neturi
Karoliniškių,1956 05 16,Vedęs,Nebuvo,"Asociacija ""Lietuvos keliai"", konsultantas finansų ir ekonomikos klausimais",Jonas LIONGINAS,Vilnius ,"1980 - Vilniaus universitetas, Ekonomistas;1975 - Vilniaus elektromechanikos technikumas, Technikas-matematikas;1971 - Vilniaus m. 21-oji vid. m-kla",Fotografija,,Lietuvos liberalų sąjunga,,,Anglų,Nėra,Neturi
Karoliniškių,1956 08 20,Vedęs,Nebuvo,"Lietuvos Respublikos Seimas, Seimo narys",Regimantas ČIUPAILA,Kaunas ,"1979 - Vilniaus universitetas, Matematikos fakultetas, Matematikos dėstytojas",,,Lietuvos centro sąjunga,,,Anglų,Nėra,Neturi
Karoliniškių,1964 09 29,,Nebuvo,"UAB ""Kopijavimo sistemos"", komercijos direktorius",Saulius BERULIS,Vilnius ,"1989 - Vilniaus universitetas, Archeologas",Dirbti,,Moderniųjų krikščionių demokratų sąjunga,,,Anglų,Nėra,Neturi
Karoliniškių,1940 11 19,Vedęs,Nebuvo,"UAB ''Bervis ir Co'', prezidentas",Vytautas BERNATONIS,Vilnius ,"1970 - Vilniaus inžinierinis statybos institutas, inžinierius mechanikas",Darbas,,"Lietuvos liaudies sąjunga ""Už teisingą Lietuvą""",,,Rusų,Nėra,Neturi
Lazdynų,1967 07 23,Vedęs,Nebuvo,"Vilniaus universiteto tarptautinių santykių ir politikos mokslų institutas, dėstytojas",Gintaras STEPONAVIČIUS,Vilnius ,"1992 - VU Teisės fakultetas, Teisininkas;1985 - A. Vienuolio vid. m-kla",Kinas,,Lietuvos liberalų sąjunga,,,Anglų,Nėra,Neturi
