apygarda,gimimo_data,seimynine_padetis,sunkus_nusikaltimas,darboviete,kandidatas,gyvena,issilavinimas,pomegiai,gimimo_vieta,iskele,tautybe,saraso_numeris,uzsienio_kalbos,pripazintas_kaltu,neatlikta_bausme
Kretingos,1945-09-20,išsituokusi,Ne,"Lietuvo radijo ir televizijos komisija,Komisijos narė, atstovauju LRS.",JANĖ    NARVILIENĖ,Padvarių k.,Aukštasis;Vilniaus valstybinis pedagoginis institutas;rusų kalbos ir literatūros mokytoja;1975,,"Ignalinos rajonas, Čiapiejų kaimas",Politinė partija „Sąjunga Taip“,lietuvė ,,"vokiečių, rusų",Ne,Neturiu
Mažeikių,1960-04-07,išsituokusi,Ne,"UAB ""Santarvės laikraštis"",vyr. redaktorė",AUDRONĖ    MALŪKIENĖ,Mažeikiai,Aukštasis;Vilniaus universitetas;žurnalistika;2010,"knygų skaitymas, kelionės",Mažeikių miestas,Politinė partija „Sąjunga Taip“,lietuvė ,,"rusų, anglų",Ne,Neturiu
Dainavos,1978-01-03,vedęs,Ne,"Asociacija ""Skambino laisvalaikio centras"",Direktorius",SAULIUS    SKAMBINAS,Kaunas,"Aukštasis universitetinis;Lietuvos kūno kultūros akademija;Choreografas, pedagogas;2001","Sportas, kelionės, šokiai",Kaunas,Politinė partija „Sąjunga Taip“,lietuvis ,,"anglų, rusų, lenkų",Ne,Neturiu
Žirmūnų,1983-01-04,nevedęs,Ne,"Vilniaus m. savivaldybės administracija,tarybos narys",JONAS    JUODKA,Vilnius,Aukštasis magistrinis;VU TSPMI;tarptautiniai santykiai ir diplomatija;2010;Aukštasis universitetinis;VU Filosofijos fakultetas;filosofija;2006,"istorija, politika, filososfija, astronomija, sportas, IT.",Vilnius,Politinė partija „Sąjunga Taip“,lietuvis ,,"anglų, vokiečių, rusų",Ne,Neturiu
Anykščių - Kupiškio,1972-08-23,vedęs,Ne,"VšĮ sostinės moterų krepšinio klubas,direktorius",ROSVALDAS    GORBAČIOVAS,Vilnius,Aukštasis magistrinis;Vilniaus Pedagoginis Universitetas;lietuvių kalbos ir literatūros mokytojas;1995,"kelionės, skaitymas, sportas",Alytus,Politinė partija „Sąjunga Taip“,lietuvis ,,"anglų, rusų, lenkų",Ne,Neturiu
Daugiamandatė,1952-04-19,ištekėjusi,Ne,"Vilniaus gimnastikos mokykla,direktoriaus pavaduotoja",OLGA    GORŠKOVA,Vilnius,Aukštasis;Vilniaus pedagoginis institutas;rusų kalbos ir literatūros;1981,"literatūra, menas",Vilnius,Politinė partija „Sąjunga Taip“,rusė ,,anglų,Ne,Neturiu
Karoliniškių,1971-08-26,vedęs,Ne,"Nacionalinė Žemės Tarnyba prie Žemės Ūkio Ministerijos,Vilniaus rajono vedėjas",LAIMAS    DIENINIS,Vilnius,Aukštasis teisės mokslų magistras;LTU;Teisė ir valdymas;2003;Aukštasis universitetinis;VPU;pedagogas;1996,"Sportas, aktyvus poilsis gamtoje, kelionės – turizmas, literatūra, kultūros renginiai, kinas, muzika.",Vilnius,Politinė partija „Sąjunga Taip“,lietuvis ,,"anglų, rusų, lenkų",Ne,Neturiu
Molėtų - Švenčionių,1980-01-13,Nenurodė,Ne,"LR Seimas,LR Seimo narė",ZITA    UŽLYTĖ,Vilnius,Magistro laipsnis;Mykolo Romerio universitetas;Europos Sąjungos politika ir administravimas;2009;Bakalauras;Vilniaus pedagoginis universitetas;Lietuvių kalbos filologija;2005,"Joga, sveika gyvensena, pramoginiai šokiai, menas ir literatūra, floristika, kelionės, tapyba.",Švenčionys,Politinė partija „Sąjunga Taip“,lietuvė ,,"rusų, anglų, lenkų, vokiečių",Ne,Neturiu
Skuodo  - Mažeikių,1966-06-17,vedęs,Ne,"Ūkininkė Dainora Miliauskienė,ūkio vadovas",ANTANAS    NAUJOKAS,Mažeikiai,Universitetinis;Maskvos naujasis teisės institutas;teisininkas;2005;Universitetinis;Lietuvos žemės ūkio universitetas;ekonomistas;1996,"medžioklė, galvijų auginimas",Kauno raj.,Politinė partija „Sąjunga Taip“,lietuvis ,,rusų,Ne,Neturiu
Šilutės - Pagėgių,1967-01-27,vedęs,Ne,"Šilutės rajono savivaldybės taryba,narys",ARVYDAS    JAKAS,Šilutė,Aukštasis;Vilniaus Universitetas;prekybos ekonomika;1991,"sportas, kelionės, žūklė.",Šilutės miestas,Politinė partija „Sąjunga Taip“,lietuvis ,,"rusų, anglų",Ne,Neturiu
Šakių,1987-03-02,nevedęs,Ne,"Všį ""Azzara"",direktorius",EDGARAS    STANIŠAUSKAS,Vilnius,Vilniaus miesto savivaldybės taryba;2011 - ,"menas, kultūra, kelionės, politinės aktualijos, vandens sportas.",Jonava,Politinė partija „Sąjunga Taip“,lietuvis ,,"rusų, vokiečių",Ne,Neturiu
Pakruojo - Joniškio,1965-02-21,vedęs,Ne,"UAB Argūnė Komercijos direktorius,",SAULIUS    GEGIECKAS,Pakruojis,Aukštasis universitetinis;Lietuvos žemės ūkio akademija;Ekonomistas organizatorius;1988,"Žvejyba,sportas,knygų skaitymas.",Pakruojo rajonas Noreikoniu km.,Politinė partija „Sąjunga Taip“,lietuvis ,,,Ne,Neturiu
Šilalės - Šilutės,1953-05-16,našlė,Ne,"LR Seimo kanceliarija,Europos reikalų komiteto biuro patarėja",DANUTĖ    BUDREIKAITĖ,Vilnius,Daktaro laipsnis;Centrinis ekonomikos matematikos institutas;Ekonomika;1987;Aukštasis;Vilniaus universitetas;Ekonomistė;1972,"kelionės, slidinėjimas, skaitymas, kulinarija","Vilnius, Lietuvos Respublika",Politinė partija „Sąjunga Taip“,lietuvė ,,"anglų, vokiečių, rusų",Ne,Neturiu
Panemunės,1986-11-29,nevedęs,Ne,"Visuomeninė organizacija ""Vieningas Kaunas"",Direktorius",POVILAS    MAČIULIS,Kaunas,Nebaigtas aukštasis;Kauno technologijos universitetas;Ekonomika;2013;aukštasis universitetinis bakalauras;Vilniaus dailės akademija Kauno fakultetas;Dizainas;2011,"Kultūra, sportas, visuomeninė veikla","Kaunas, Lietuva",Politinė partija „Sąjunga Taip“,lietuvis ,,anglų,Ne,Neturiu
Biržų - Kupiškio,1975-07-15,vedęs,Ne,"UAB ,,Savicko sporto klubas'',direktorius",ŽYDRŪNAS    SAVICKAS,Vilnius,Vilniaus miesto savivaldybės Tarybos narys;2012 - 2012,"sportas, knygos, kelionės",Biržai,Politinė partija „Sąjunga Taip“,lietuvis ,,,Ne,Neturiu
Aleksoto -  Vilijampolės,1945-08-14,išsituokusi,Ne,"Vilniaus Universitetas, Kauno humanitarinis fakultetas,docentė",JŪRATĖ    MATEKONIENĖ,Kaunas,Aukštasis;KTU;Inžinierė-ekonomistė;1967,"pasaulio ekonomikos pokyčiai,psichologija, filosofija, literatūra",Žuvinto k. Alytaus apskr. Lietuva,Politinė partija „Sąjunga Taip“,lietuvė ,,,Ne,Neturiu
Varėnos - Eišiškių,1978-05-05,vedęs,Ne,"Lietuvos Respublikos Seimas,Seimo narys",VYTAUTAS    KURPUVESAS,Vilnius,Aukštasis;Lietuvos teisės universitetas;teisininkas;2002,,Vilniaus raj.,Politinė partija „Sąjunga Taip“,lietuvis ,,"rusų, lenkų, anglų",Ne,Neturiu
Justiniškių,1955-01-25,išsituokusi,Ne,"VšĮ Vilko valia,direktorė",RŪTA    VANAGAITĖ,Vilnius,Aukštasis;Maskvos V.Lunačiarskio teatro meno institutas;teatrologija;1976,"dviračių sportas, slidinėjimas, žvejyba",Šiaulių miestas,Politinė partija „Sąjunga Taip“,lietuvė ,,"anglų, rusų, lenkų, suomių, prancūzų",Ne,Neturiu
Daugiamandatė,1975-08-07,vedęs,Ne,"Vilniaus universitetas,Katedros vedėjas, docentas",DONATAS    PILINKUS,Kaunas,Daktaro laipsnis;KTU;Socialinių mokslų (ekonomika);2010;Magistro laipsnis;VU;Vadyba ir verslo administravimas;2003;Bakalauro laipsnis;VU;Vadyba ir verslo administravimas;2001;Bakalauro laipsnis;VU;Anglų filologija;1997,"Knygų skaitymas, šachmatai, žūklė, kelionės",Kėdainiai,Politinė partija „Sąjunga Taip“,lietuvis ,,"anglų, rusų",Ne,Neturiu
Šeškinės,1963-08-26,nevedęs,Ne,"Lietuvos Respublikos Seimas,Lietuvos Respublikos Seimo narys",LIGITAS    KERNAGIS,Jonava,Aukštasis;Kauno politechnikos institutas;Elektros tiekimas;1986,"Muzika, sportas, kelionės","Panevėžio raj., Lietuva",Politinė partija „Sąjunga Taip“,lietuvis ,,"anglų, rusų",Ne,Neturiu
Senamiesčio,1971-07-31,ištekėjusi,Ne,"Lietuvos Respublikos Seimas,Seimo narė",AGNĖ    ZUOKIENĖ,Vilnius,Aukštasis;VU;žurnalistika;1994,skaitymas,Vilnius,Politinė partija „Sąjunga Taip“,lietuvė ,,"anglų, rusų",Ne,Neturiu
Naujamiesčio,1980-12-05,vedęs,Ne,"Asociacija ""Tėvynės atgimimas ir perspektyva"",programų vadovas",MIROSLAVAS    MONKEVIČIUS,Vilnius,"Aukštasis magistrinis;VU, TSPMI;politikos mokslai;2006",nardymas; skaitymas,Šalčininkų raj.,Politinė partija „Sąjunga Taip“,lietuvis ,,"anglų, rusų, lenkų",Ne,Neturiu
Fabijoniškių,1970-03-03,vedęs,Ne,"Lietuvos Respublikos Seimas,narys",ŽILVINAS    ŠILGALIS,Vilnius,Aukštasis;Kauno technologijos universitetas;inžinierius-ekologas;2003,,Kauno miestas,Politinė partija „Sąjunga Taip“,lietuvis ,,"rusų, anglų pagrindai",Ne,Neturiu
Daugiamandatė,1968-02-21,vedęs,Ne,"Vilniaus miesto savivaldybė,meras",ARTŪRAS    ZUOKAS,Vilnius,Aukštasis;VU;žurnalistika;1998,"fotografija, buriavimas",Kaunas,Politinė partija „Sąjunga Taip“,lietuvis ,,"anglų, rusų, vokiečių",	 ,Neturiu
Daugiamandatė,1974-09-22,nevedęs,Ne,"VŠĮ ARMO Consulting,Direktorius",BERNARDAS    ŠATKOVSKIS,Vilnius,Aukštasis;Lietuvos muzikos ir teatro akdemija;Muzikologas;2002,"aktyvus laisvalaikis, sportas, istorija, mokslas, politika",Vilnius,"Nacionalinis susivienijimas „Už Lietuvą Lietuvoje“ (Lietuvos centro partijos, Lietuvos socialdemokratų sąjungos, Tautininkų sąjungos ir Tautos vienybės sąjungos koalicija)",lietuvis ,,"anglų, vokiečių, rusų",Ne,Neturiu
Daugiamandatė,1952-04-10,vedęs,Ne,"Vilniaus miesto savivaldybės administracijos Šeškinės seniūnija,vyriausiasis specialistas",RAIMUNDAS    GRUMADAS,Vilnius,Aukštasis universitetinis;Mykolo Riomerio universitetas;Socialinis darbas;2005;Aukštesnysis;Vilniaus Politechnikumas;Automobilių transporto eksplotacija;1986;Vidurinis;Vilniaus m. 23-oji vid. m-kla;abiturientas;1970,,Kretinga,"Nacionalinis susivienijimas „Už Lietuvą Lietuvoje“ (Lietuvos centro partijos, Lietuvos socialdemokratų sąjungos, Tautininkų sąjungos ir Tautos vienybės sąjungos koalicija)",lietuvis ,,"rusų, anglų, lenkų",Ne,Neturiu
Daugiamandatė,1982-01-28,nevedęs,Ne,"UAB ""Valentis"",-",MINDAUGAS    ZILNYS,Vilnius,Aukštasis universitetinis;Vilniaus Universitetas;Archeologija;2004,"sportas, knygos, kelionės",Vilnius,"Nacionalinis susivienijimas „Už Lietuvą Lietuvoje“ (Lietuvos centro partijos, Lietuvos socialdemokratų sąjungos, Tautininkų sąjungos ir Tautos vienybės sąjungos koalicija)",lietuvis ,,"rusų, anglų, lotynų",Ne,Neturiu
Daugiamandatė,1984-07-26,nevedęs,Ne,"I.Į. G. ZUBRICKO FIRMA,inžinierius projektuotojas",AURIMAS    JANONIS,Naujojo Lentvario k.,Magistras;MRU;Strateginis įmonių valdymas;2011;Magistras;VGTU;Inžinierinė informatika;2008;Bakalauras;VGTU;Elektronika;2006,,Vilnius,"Nacionalinis susivienijimas „Už Lietuvą Lietuvoje“ (Lietuvos centro partijos, Lietuvos socialdemokratų sąjungos, Tautininkų sąjungos ir Tautos vienybės sąjungos koalicija)",lietuvis ,,"anglų, rusų",Ne,Neturiu
Daugiamandatė,1986-07-23,vedęs,Ne,"AB ""Panevėžio keliai"",inžinierius-projektuotojas",PAULIUS    ZYKAS,Vilnius,Aukštasis;Vilniaus Gedimino technikos Universitetas;transporto inžinerija;2010,,Kėdainiai,"Nacionalinis susivienijimas „Už Lietuvą Lietuvoje“ (Lietuvos centro partijos, Lietuvos socialdemokratų sąjungos, Tautininkų sąjungos ir Tautos vienybės sąjungos koalicija)",lietuvis ,,"anglų, rusų",Ne,Neturiu
Daugiamandatė,1958-05-04,vedęs,Ne,"UAB DK ""PZU Lietuva"",skyriaus direktorius",VALENTINAS    MIZEIKIS,Biržai,Aukštasis;Kauno technologijos universitetas (Kauno politechnikos institutas);automatinio elektros ryšio inžinierius;1982,žvejyba,Kaunas,"Nacionalinis susivienijimas „Už Lietuvą Lietuvoje“ (Lietuvos centro partijos, Lietuvos socialdemokratų sąjungos, Tautininkų sąjungos ir Tautos vienybės sąjungos koalicija)",lietuvis ,,rusų,Ne,Neturiu
Daugiamandatė,1977-03-31,vedęs,Ne,"Individualios veiklos liudijimas,",DARIUS    BARTAŠIUS,Gruzdžių mstl.,Aukštasis;Šiaulių universitetas;Statybos inžinierius;2003,,Šiauliai,"Nacionalinis susivienijimas „Už Lietuvą Lietuvoje“ (Lietuvos centro partijos, Lietuvos socialdemokratų sąjungos, Tautininkų sąjungos ir Tautos vienybės sąjungos koalicija)",lietuvis ,,"rusų, vokiečių",Ne,Neturiu
Daugiamandatė,1978-10-14,vedęs,Ne,"UAB ""Mars Lietuva"",Pamainos meistras",RIČARDAS    ŠALKAUSKAS,Bokštų k.,Aukštasis universitetinis;Klaipėdos valstybinė kolegija;Mechanikas - inžinierius;2010,"skaitymas, istorija, aktyvus laisvalaikis, sportas",Klaipėda,"Nacionalinis susivienijimas „Už Lietuvą Lietuvoje“ (Lietuvos centro partijos, Lietuvos socialdemokratų sąjungos, Tautininkų sąjungos ir Tautos vienybės sąjungos koalicija)",lietuvis ,,"rusų, vokiečių, anglų",Ne,Neturiu
Daugiamandatė,1965-04-01,vedęs,Ne,",",SAULIUS    ADOMAVIČIUS,Kaunas,Universitetinis;KTU Socialinių mokslų fak.;Vadybos ir verslo administravimas;2002;Universitetinis;LŽŪA Agronomijos fak.;Mokslinis agronomas;1991,"techninės sporto šakos, muzika",Kaunas,"Nacionalinis susivienijimas „Už Lietuvą Lietuvoje“ (Lietuvos centro partijos, Lietuvos socialdemokratų sąjungos, Tautininkų sąjungos ir Tautos vienybės sąjungos koalicija)",lietuvis ,,"rusų, anglų",Ne,Neturiu
Daugiamandatė,1955-08-31,našlė,Ne,"Lietuvos istorijos institutas,jaunesnioji mokslo darbuotoja",DANUTĖ    BLAŽYTĖ-BAUŽIENĖ,Vilnius,Aukštasis;Vilniaus universitetas;Istorikė;1978;Vidurinis;Pandėlio vidurinė mokykla;abiturientė;1973,"kraštotyra, operinė muzika","Žvirblių km., Pandėlio sen., Rokiškio raj.","Nacionalinis susivienijimas „Už Lietuvą Lietuvoje“ (Lietuvos centro partijos, Lietuvos socialdemokratų sąjungos, Tautininkų sąjungos ir Tautos vienybės sąjungos koalicija)",lietuvė ,,"lenkų, rusų, vokiečių",Ne,Neturiu
Daugiamandatė,1966-12-30,našlė,Ne,"bedarbė,",RIMA    ŠTEFANE,Mitkaičių k.,Aukštasis;Latvijas Universitetas;Filologija;2002,,Mažeikiai,"Nacionalinis susivienijimas „Už Lietuvą Lietuvoje“ (Lietuvos centro partijos, Lietuvos socialdemokratų sąjungos, Tautininkų sąjungos ir Tautos vienybės sąjungos koalicija)",lietuvė ,,"vokiečių, latvių, rusų",Ne,Neturiu
Daugiamandatė,1953-12-24,išsituokusi,Ne,"Mažeikių Kalnėnų pagrindinė mokykla,Matematikos mokytoja",IRUTĖ    GEDUTIENĖ,Mažeikiai,Aukštasis;Valstybinis pedagoginis institutas;mokytoja;1975,rankdarbiai,"Artiomo gyv., Bodaibo raj. Irkutsko sritis","Nacionalinis susivienijimas „Už Lietuvą Lietuvoje“ (Lietuvos centro partijos, Lietuvos socialdemokratų sąjungos, Tautininkų sąjungos ir Tautos vienybės sąjungos koalicija)",lietuvė ,,"anglų, rusų",Ne,Neturiu
Daugiamandatė,1963-09-11,vedęs,Ne,"UAB ""Ekoprana"",Direktorius",ARŪNAS    MATULIS,Kaunas,Aukštasis;Kauno Politechnikos institutas;Inžinierius;1986;Vidurinis;Pasvalio vid. mokykla;abiturientas;1981,,Trakai,"Nacionalinis susivienijimas „Už Lietuvą Lietuvoje“ (Lietuvos centro partijos, Lietuvos socialdemokratų sąjungos, Tautininkų sąjungos ir Tautos vienybės sąjungos koalicija)",lietuvis ,,"rusų, prancūzų",Ne,Neturiu
Vilkaviškio,1955-08-20,išsiskyręs,Ne,"AB Lietuvos Geležinkeliai,Vilniaus infrastruktūra vyriausiasis specialistas",ALGIMANTAS    ARNASTAUSKAS,Vilnius,Aukštesnysis;Vilniaus Technologijos technikumas;technikas-mechanikas;1978,"žvejyba, grybavimas, knygų skaitymas","Švėkšna, Šilutės raj.",Lietuvos centro partija,lietuvis ,,rusų,Ne,Neturiu
Daugiamandatė,1944-05-12,vedęs,Ne,"Pensininkas,",MINDAUGAS    KONČIUS,Šiauliai,Aukštasis;Kauno Politechnikos institutas;Radijo inžinierius;1970,,Kaunas,"Nacionalinis susivienijimas „Už Lietuvą Lietuvoje“ (Lietuvos centro partijos, Lietuvos socialdemokratų sąjungos, Tautininkų sąjungos ir Tautos vienybės sąjungos koalicija)",lietuvis ,,"rusų, anglų",Ne,Neturiu
Naujosios Vilnios,1975-09-14,išsiskyręs,Ne,"BARCLAYS TECHNOLOGY CENTRE LIMITED LIETUVOS FILIALAS,Infrastruktūros techninis specialistas",TOMAS    BIKELIS,Vilnius,Magistras;Vilniaus Universitetas;Lazerių fizika;1999,"kelionės, civilizacijų istorija, fotografija, ginklai",Vilnius,Lietuvos centro partija,lietuvis ,,"anglų, švedų, rusų, lenkų, vokiečių, prancūzų",Ne,Neturiu
Daugiamandatė,1959-05-14,vedęs,Ne,"VĮ ""Panevėžio regiono keliai"",skyriaus viršininkas",RIMANTAS    MAKRICKAS,Staniūnų k.,Aukštasis;Vilniaus Gedimino Technikos Universitetas;Civilinė inžinerija;2001,"Kelionės, fotografija, darbas sode, knygų skaitymas",Pasvalys,"Nacionalinis susivienijimas „Už Lietuvą Lietuvoje“ (Lietuvos centro partijos, Lietuvos socialdemokratų sąjungos, Tautininkų sąjungos ir Tautos vienybės sąjungos koalicija)",lietuvis ,,"rusų, prancūzų",Ne,Neturiu
Varėnos - Eišiškių,1959-12-16,vedęs,Ne,"Varėnos krašto vietos veiklos grupė,projektų koordinatorius",ALVYDAS    VALEIŠA,Naujųjų Valkininkų k.,Aukštasis universitetinis;Aleksandro Stulginskio universitetas;Miškininkas - inžinierius;1983,"meistravimas, knygų skaitymas, politika","Liaukiškių km., Čiobiškio sen., Širvintų raj.",Lietuvos centro partija,lietuvis ,,,Ne,Neturiu
Daugiamandatė,1942-05-22,vedęs,Ne,"Klaipėdos universitetas,docentas",ALBINAS    STANKUS,Palanga,Aukštasis;Kauno medicinos institutas;Gydytojas;1966,,Laukuvos mstl.,"Nacionalinis susivienijimas „Už Lietuvą Lietuvoje“ (Lietuvos centro partijos, Lietuvos socialdemokratų sąjungos, Tautininkų sąjungos ir Tautos vienybės sąjungos koalicija)",lietuvis ,,"vokiečių, anglų",Ne,Neturiu
Gargždų,1971-09-23,nevedęs,Ne,"-,-",MINDAUGAS    KRENCIUS,Gargždai,Aukštasis universitetinis;Klaipėdos universitetas;Istorikas;2012,"istorija, knygų skaitymas, pažintinės kelionės",Klaipėda,Lietuvos centro partija,lietuvis ,,"vokiečių, rusų",Ne,Neturiu
Pajūrio,1974-10-25,vedęs,Ne,"Palangos kultūros centras,direktoriaus pavaduotojas",NERIJUS    STASIULIS,Palanga,Vidurinis;Palangos V. Jurgučio vidurinė mokykla;abiturientas;1993,,"Tūbausių km., Kretingos raj.",Lietuvos centro partija,lietuvis ,,"rusų, anglų",Ne,Neturiu
Centro,1953-08-02,vedęs,Ne,",",VLADAS    BURAGAS,Kaunas,Aukštasis universitetinis;Vilniaus Universitetas;ekonominė kibernetika;1976,"literatūra, tautotyra, politika (ekonomikos, kultūros ir savivaldos klausimais)","Švitrūnų km., Alvito apylinkė, Vilkaviškio raj.",Lietuvos centro partija,lietuvis ,,"anglų, rusų",Ne,Neturiu
Daugiamandatė,1958-08-10,vedęs,Ne,"Šiaulių universitetas,Profesorius",ARŪNAS    GUMULIAUSKAS,Šiauliai,Aukštasis;Vilniaus universitetas;Istorikas;1981,"sportas, teatras",Kaunas,"Nacionalinis susivienijimas „Už Lietuvą Lietuvoje“ (Lietuvos centro partijos, Lietuvos socialdemokratų sąjungos, Tautininkų sąjungos ir Tautos vienybės sąjungos koalicija)",lietuvis ,,"rusų, lenkų, vokiečių",Ne,Neturiu
Daugiamandatė,1951-02-01,vedęs,Ne,"Vidaus reikalų ministerija,Sanglaudos skatinimo veiksmų programos skyriaus vedėjas",ARŪNAS    GRUMADAS,Vilnius,Aukštasis universitetinis;Vilniaus Universitetas;Fizikas;1974;Aukštasis universitetinis;Maskvos Lomonosovo universitetas;Gamtos mokslų daktaras;1974;Vidurinis;Vilniaus 2-oji vidurinė mokykla;abiturientas;1969,,Kretinga,"Nacionalinis susivienijimas „Už Lietuvą Lietuvoje“ (Lietuvos centro partijos, Lietuvos socialdemokratų sąjungos, Tautininkų sąjungos ir Tautos vienybės sąjungos koalicija)",lietuvis ,,lenkų,Ne,Neturiu
Karoliniškių,1963-11-30,vedęs,Ne,"Mykolo Romerio Universitetas,dėstytojas",ALVYDAS    MEDALINSKAS,Vilnius,Aukštasis;Londono aukštoji ekonomikos mokykla;tarptautinių santykių magistras;1992;Aukštasis universitetinis;Vilniaus valstybinis universitetas;ekonomistas;1985;Vidurinis;Vilniaus 41-oji vid. mokykla (dabar Karoliniškių gimnazija);abiturientas;1981,"knygos, teatras, muzika, pažinti savo ir kitus kraštus",Vilnius,Lietuvos centro partija,lietuvis ,,"anglų, rusų",Ne,Neturiu
Daugiamandatė,1952-10-11,vedęs,Ne,"Romualdo Ozolo paramos fondas ""Už teisingumą Lietuvoje"",Direktorius",EUGENIJUS    SKRUPSKELIS,Vilnius,Aukštasis universitetinis;Vilniaus Universitetas;Paveldosaugininkas;2007;Aukštasis universitetinis;Vilniaus Universitetas;Istorikas;1976,"knygos, žvejyba, sportas","Linkuva, Pakruojo raj.","Nacionalinis susivienijimas „Už Lietuvą Lietuvoje“ (Lietuvos centro partijos, Lietuvos socialdemokratų sąjungos, Tautininkų sąjungos ir Tautos vienybės sąjungos koalicija)",lietuvis ,,"rusų, anglų",Ne,Neturiu
Daugiamandatė,1964-08-07,vedęs,Ne,"A.Kimčio įmonė,savininkas",ALVYDAS    KIMTYS,Mažeikiai,Aukštesnysis;Šiaulių aukštesnioji muzikos mokykla;mokytojas;1983,"muzika, autokrosas",Mažeikiai,"Nacionalinis susivienijimas „Už Lietuvą Lietuvoje“ (Lietuvos centro partijos, Lietuvos socialdemokratų sąjungos, Tautininkų sąjungos ir Tautos vienybės sąjungos koalicija)",lietuvis ,,rusų,Ne,Neturiu
Daugiamandatė,1972-12-26,Nenurodė,Ne,",",RAMŪNAS    RAMANAUSKAS,Kaunas,,,,"Nacionalinis susivienijimas „Už Lietuvą Lietuvoje“ (Lietuvos centro partijos, Lietuvos socialdemokratų sąjungos, Tautininkų sąjungos ir Tautos vienybės sąjungos koalicija)", ,,,Ne,Neturiu
Daugiamandatė,1955-07-02,ištekėjusi,Ne,",",ANGELIJA    RANCEVIENĖ,Vilnius,Aukštasis;VGTU;inž.- statybininkas;1977,"kelionės, sportas",Šilutės r.,"Nacionalinis susivienijimas „Už Lietuvą Lietuvoje“ (Lietuvos centro partijos, Lietuvos socialdemokratų sąjungos, Tautininkų sąjungos ir Tautos vienybės sąjungos koalicija)",lietuvė ,,"rusų, anglų",Ne,Neturiu
Daugiamandatė,1958-01-09,vedęs,Ne,",",ZIGMANTAS    VALIULIS,Šiauliai,Aukštasis;Kauno technologijos universitetas;inžinierius elektrikas;1985,skaitymas,Šiaulių raj.,"Nacionalinis susivienijimas „Už Lietuvą Lietuvoje“ (Lietuvos centro partijos, Lietuvos socialdemokratų sąjungos, Tautininkų sąjungos ir Tautos vienybės sąjungos koalicija)",lietuvis ,,"anglų, rusų",Ne,Neturiu
Daugiamandatė,1950-01-08,vedęs,Ne,",",LIUDAS    VEDECKIS,Šeduva,"Aukštasis;KTU;Viešojo administravimo magistras;2006;Aukštasis;JAV tarptautinis Krikščionių institutas (Oklahoma);Evangelistas-misionierius;1999;Aukštasis;LTSR valstybinė Tautų draugystės ordino konservatorija;Kultūros, švietimo darbuotojo, orkestro vadovo;1985;Spec. vidurinis;Kauno J.Gruodžio aukšt. muz. m-la;Pučiamųjų orkestrų;1970","šachmatai, tenisas",Radviliškio r.,"Nacionalinis susivienijimas „Už Lietuvą Lietuvoje“ (Lietuvos centro partijos, Lietuvos socialdemokratų sąjungos, Tautininkų sąjungos ir Tautos vienybės sąjungos koalicija)",lietuvis ,,"rusų, anglų",Ne,Neturiu
Lazdijų - Druskininkų,1965-02-12,vedęs,Ne,"VšĮ Lazdijų ligoninė,vaikų ligų skyriaus vedėjas",GYTIS    JACKŪNAS,Lazdijai,Aukštasis;Vilniaus universitetas;vaikų ligų gydytojas;1994,"netradicinė medicina, knygos, kelionės",Vilnius,Lietuvos socialdemokratų sąjunga,lietuvis ,,"rusų, anglų",Ne,Neturiu
Daugiamandatė,1962-03-11,ištekėjusi,Ne,"Klaipėdos m. Liudviko Stulpino progimnazija,mokytoja",NIJOLĖ    DARGUŽIENĖ,Klaipėda,Aukštasis;VVPU;Mokytoja;1985,"knygos, muzika","Jonavos r., Bakonių km.","Nacionalinis susivienijimas „Už Lietuvą Lietuvoje“ (Lietuvos centro partijos, Lietuvos socialdemokratų sąjungos, Tautininkų sąjungos ir Tautos vienybės sąjungos koalicija)",lietuvė ,,"rusų, anglų",Ne,Neturiu
Daugiamandatė,1960-09-17,ištekėjusi,Ne,"UAB ""Piropas"",vyr. buhalterė",BIRUTĖ    BUDRECKIENĖ,Mažeikiai,Aukštasis neuniversitetinis;Kauno ekonom. technikumas;buhalterė;1986,"bitininkystė, kelionės","Mažeikių r., Bugenių km.","Nacionalinis susivienijimas „Už Lietuvą Lietuvoje“ (Lietuvos centro partijos, Lietuvos socialdemokratų sąjungos, Tautininkų sąjungos ir Tautos vienybės sąjungos koalicija)",lietuvė ,,rusų,Ne,Neturiu
Daugiamandatė,1939-11-20,vedęs,Ne,"Mykolo Romerio universitetas,profesorius",GEDIMINAS    DAVULIS,Vilnius,Aukštasis;Kauno tech.instituas;inžinierius;1963,,Utena,"Nacionalinis susivienijimas „Už Lietuvą Lietuvoje“ (Lietuvos centro partijos, Lietuvos socialdemokratų sąjungos, Tautininkų sąjungos ir Tautos vienybės sąjungos koalicija)",lietuvis ,,"anglų, rusų, lenkų",Ne,Neturiu
Daugiamandatė,1960-09-01,našlė,Ne,"UAB ""Krašto spauda"",korespondentė",NIJOLĖ    BARONIENĖ,Vilnius,Aukštasis;Valstybinė konservatorija;TV režisūra;1984,sodininkystė,"Klaipėdos raj, Maciučių k.","Nacionalinis susivienijimas „Už Lietuvą Lietuvoje“ (Lietuvos centro partijos, Lietuvos socialdemokratų sąjungos, Tautininkų sąjungos ir Tautos vienybės sąjungos koalicija)",lietuvė ,,rusų,Ne,Neturiu
Daugiamandatė,1967-06-18,vedęs,Ne,"UAB ""Armena"",Vadybininkas",RIMANTAS    PAKALNIS,Vilnius,Aukštasis neuniversitetinis;Vilniaus stat. techn.;technikas;1986,muzika,Švenčionių r.,"Nacionalinis susivienijimas „Už Lietuvą Lietuvoje“ (Lietuvos centro partijos, Lietuvos socialdemokratų sąjungos, Tautininkų sąjungos ir Tautos vienybės sąjungos koalicija)",lietuvis ,,,Ne,Neturiu
Daugiamandatė,1954-11-15,vedęs,Ne,"MRU,lektorius",ROMUALDAS    KACEVIČIUS,Vilnius,Aukštasis;Vilniaus universitetas;psichologas;1982,,"Rietavo m., Plungės rajonas","Nacionalinis susivienijimas „Už Lietuvą Lietuvoje“ (Lietuvos centro partijos, Lietuvos socialdemokratų sąjungos, Tautininkų sąjungos ir Tautos vienybės sąjungos koalicija)",lietuvis ,,"anglų, rusų",Ne,Neturiu
Daugiamandatė,1963-01-28,išsituokęs,Ne,"Muitinės informacinių sistemų centras,poskyrio viršininkas",JŪRIUS    BRUKLYS,Vilnius,Aukštasis;VU;MATEMATIKAS;1985,Lietuvos istorija,"Latvija, Jelgava","Nacionalinis susivienijimas „Už Lietuvą Lietuvoje“ (Lietuvos centro partijos, Lietuvos socialdemokratų sąjungos, Tautininkų sąjungos ir Tautos vienybės sąjungos koalicija)",vengras (-ė) ,,"anglų, rusų",Ne,Neturiu
Aušros,1966-03-04,nevedęs,	 ,",",EDVARDAS    KUVIKAS,Šiauliai,Aukštasis;Kauno Technologijos Universitetas;inžinierius;1994,"gamta, kelionė, sportas, kinas, knygos",Šiauliai,Lietuvos socialdemokratų sąjunga,lietuvis ,,"rusų, anglų",	 ,Neturiu
